num,text,label
101,"Stada ilk gelen taraftarlar kartlarının okunmaması, yanlış kapı, bilet yüklenmedi gibi uyarılarla karşılaşıp kapıda bir süre <beklemek> zorunda kaldılar. Passolig yetkililerinin sistemdeki arızayı gidermesinin ardından kapılarda biriken taraftarlar stat içine girişlerini gerçekleştirdiler. Taraftarların büyük bir bölümü Passolig uygulamasını eleştirirken bu uygulamayı destekleyenlerin de olduğu görüldü. (DHA)",0
719,"PETKİM'in KAP'ta yayımlanan açıklamasında, <Saf> Tereftalik Asit (PTA) fabrikası kapasite artış yatırımıyla ilgili imzalanan sözleşme kapsamında temel ve detay mühendislik ve ekipman / malzeme tedariğiyle ilgili APEXTECH ile toplam 14 milyon 350 bin dolarlık sözleşme imzalandığı duyuruldu. Kapasite artışı yatırımının 2 yılda tamamlanmasının planlandığı, yatırım sonrası PTA fabrikasının yıllık üretim kapasitesinin yüzde 50 artışla yıllık 70 bin tondan 105 bin tona çıkacağı kaydedildi.",0
419,"Fransız Le Figaro gazetesinin ele geçirdiği ifadede DSK’nın ‘6 kadınla birden birlikte olmak normal’ dediği görüldü. DSK ifadesinde, hep çıplak oldukları için kadınların <hayat kadını> olduğunu anlamadığını da söylüyor. DSK’nın New York’ta karıştığı seks skandalı sonrasında mahkemeden talep ettiği ‘diplomatik dokunulmazlık’ isteği de reddedildi. Etiketler:",1
77,"Barcelona forması giyen milli futbolcu Arda Turan, sosyal medya hesabı üzerinden Galatasaray'dan ayrılarak Çin ekiplerinden Beijing Guoan'a transfer olması <beklenen> Burak Yılmaz'la ilgili bir paylaşım yaptı. Arda, Instagram hesabından paylaştığı fotoğrafa, ""Her şey için teşekkürler 'Kral'... Yeni kariyerinde ailenle, sevdiklerinle, evladınla başarı, mutluluk ve huzur diliyorum. Sen her şeyin en güzelini hak ediyorsun."" notunu düştü.",0
774,"Radyospor’a konuşan Ateş, ""Webo yazın bizzat beni aradı. <Siyahi> bir oyuncu olduğu için beyaz formanın kendisine çok yakışacağını söyledi. Başkanlar düzeyinde bir görüşme oldu; ama anlaşma sağlanamadı. Belediyespor’un istediği fiyat çok yüksekti. Dengeyi bozmamak prensibi nedeniyle Webo‘dan vazgeçtik"" ifadesini kullandı",1
337,"Orgeneral Hulusi Akar'ın giydiği yeni tasarımda, ABD ordusunda kullanıldığı gibi omuzdaki rütbenin sağ <göğüse> takıldığı görüldü. Sağ göğüs üzerinde artık rütbe, birlik ve soyadı yer alacak. Bununla birlikte sol göğüste bröveler durmaya devam edecekken, kollarda Türk Bayrağı yer alacak. Fotoğraf: Arşiv",0
538,"Bursa'nın Osmangazi ilçesinin Tuna Mahallesi'nde ikamet eden H.K ile damadı R.V evlerinin terasına kanepe çıkarmak isterken facia yaşandı. Terasa bir mekanizma ile çıkarmak istenilen kanepe, halatların yeterince sağlam olmaması sebebiyle koptu. Aşağıda bekleyen damat R.V halatın koptuğunu görmeyince hızla aşağı düşen kanepenin altında kaldı. 112 Acil servisle ilk müdahalesi yapılan R.V, hastaneye kaldırılırken hayatını <kaybetti>. Olayla ilgili detaylı araştırmalar devam ediyor.",1
685,Müzakere  ruznamesi reis tarafından yapılır ve ruznameye giren maddeler <muayyen günde> sırasıyla okunur  ve müzakere edilir.,0
301,"Çağla Şikel’in geçen hafta ""Her Şey Dahil"" programında dans ederken <göğsü> açılmıştı. Çok konuşulan bu canlı yayın kazası, Youtube'da ‘En Popüler Video’ kategorisinde yer aldı ve 1 milyon kez izlendi. AVUKATI DEVREDE Vatan'dan Gülşen Yüksel'in haberine göre, Görüntülerden çok rahatsız olan 2 çocuk annesi Şikel, 40’ın üzerinde internet sitesinde yer alan videolarla ilgili harekete geçti. Avukatına talimat vererek görüntülerin kaldırılmasını talep etti.",1
711,"Bir ihbarı değerlendiren Başkale Jandarma Komutanlığı ekipleri, Bebleşin Jandarma Asayiş Noktası'nda yol kontrol uygulaması yaptı. F.F. yönetimindeki 61 DT 129 plakalı minibüste arama yapan jandarma ekipleri, koltukların altındaki gizli bölmelerde 104 paket halinde toplam 55 kilo 520 gram <saf> eroin buldu. Gözaltına alınan sürücü tutuklandı.",0
452,"Nilüfer’in uzun zamandır alzheimer hastası olan annesi Zeynep Lütfiye Yumlu, 97 yaşında <hayata gözlerini yumdu>. Anne Yumlu’nun cenazesi bugün Çengelköy ’deki Kerem Aydınlar Camii’nde öğle namazına müteakiben kılınacak cenaze namazının ardından Edirnekapı Mezarlığı’nda toprağa verilecek. Önceki gün Vodafone FreeZone’un düzenlediği 17. Liselerarası Müzik Yarışması’nın final gecesi sahneye çıkacağı açıklanan Nilüfer annesinin vefatından dolayı törene katılamadı.",1
481,"ÇABA Derneği’nin önceki akşam Radisson Blu Hotel Şişli’de gerçekleştirdiği davete büyük ilgi vardı. Ünlü babalar, Atelier Sıla Öztürk tasarımlarıyla modellik yapan kızlarına eşlik ettiler. Genç kadınlar, hem annelerine unutulmaz bir hediye verdi hem de <ihtiyaç sahibi> çocuklar için imkanlar yarattı. Uğurkan Erez’in koreografisiyle gerçekleşen defileyi izleyen anneler, duygusal anlar yaşadı. Podyumda atılan her adım, Florya Çocuk ve Gençlik Merkezi Binası’nın yapımına katkı sağladı. EMRAH AKÇAAY",1
754,"Amazon’un video sitesinde çizgi film serisi Tom ve Jerry, ""ırkçı önyargı"" ibaresi ile yayınlanıyor. Çizgi filmi seyretmek isteyen birisi siteye girdiğinde, ""Tom ve Jerry filmi, bir zamanlar Amerikan toplumunda sıkça karşılaşılan etnik ve ırkçı önyargılar içerebilir. Bu önyargılar o zaman yanlıştı, şimdi de yanlış"" ibaresiyle karşılaşıyor. Çizgi filmin eski bölümlerinde <siyahi> bir hizmetçinin yer almasının, verilen uyarı için bir örnek teşkil ettiği belirtiliyor. Etiketler: Amazon",1
639,"Komiteden bir yetkilinin Interfax'a yaptığı açıklamaya göre, teröristler saldırı hazırlığı yapıyordu. Rus yetkili, ""Teröristler ifadelerinde suçlarını itiraf etti. Verdikleri bilgiler çerçevesinde, bir evde 5 kilo ağırlığında 4 el yapımı patlayıcı düzeneği ve bir ton patlayıcı <madde> bulundu"" dedi. Patlayıcıların etkisiz hale getirilmesi için FSB uzmanlarının önlem aldığını kaydeden yetkili, operasyonların sürdüğünü belirtti.",0
708,"Beşiktaş, UEFA Avrupa Ligi'nde Liverpool'u <saf> dışı bırakıp Brugge ile eşleşirken TFF Süper Lig fikstüründe değişikliğe gitti. Federasyon, 12 Mart Perşembe oynanacak Club Brugge - Beşiktaş maçı nedeniyle 9 Mart Pazartesi günkü Medicana Sivasspor - Beşiktaş maçını 8 Mart Pazar 14:00'e alındığını açıkladı. Bu değişiklikten dolayı 5 Mart Perşembe günkü Kayserispor - Medicana Sivasspor Ziraat Türkiye Kupası Çeyrek Final 1. maçı da 18 Mart Çarşamba 19:30'a alındı.",0
360,"Olay öğlen saatlerinde Irak sınırına sıfır noktada bulunan Şemdinli İlçesi Derecik Beldesi Yeşilova Jandarma Karakolu'nda meydana geldi. Kayseri'deki Kocasinan İlçesi nüfusuna kayıtlı Harun Aslan, henüz bilinmeyen bir nedenle <göğsüne> bir el ateş etti. Ağır yaralı olarak kanlar içinde yere yığılan Aslan, ilk müdahale ardından helikopterle Hakkari Asker Hastanesi'ne kaldırıldı. Burada yapılan tüm müdahalelere rağmen Aslan kurtarılamadı.",0
6,TSYD İstanbul Şube Başkanı ve Cumhuriyet Gazetesi Spor Müdürü Arif Kızılyalın'ın annesi Nagihan Kızılyalın <aramızdan ayrıldı>. Nagihan Kızılyalın son yolculuğuna 22 Mart Pazar günü öğle namazına müteakip Şişli Camii'nden uğurlanacak. Kızılyalın'ın cenazesi Bebek'teki Aşiyan Mezarlığı'nda toprağa verilecek. Cumhuriyet.com.tr olarak Sayın Arif Kızılyalın ve ailesine başsağlığı diliyoruz.,1
550,"Kadıköy'deki Florence Nightingale Hastanesi'nde 30 Mart Cuma gününden beri tedavi gören ve dün akciğer ödemi nedeniyle hayatını <kaybeden> Ekrem Bora için, yarın saat 10.30'da Akatlar Kültür Merkezi'nde tören düzenlenecek. Bora'nın cenazesi, törenin ardından öğle vakti Zincirlikuyu Camisi'nde kılınacak cenaze namazının ardından Zincirlikuyu Mezarlığı'nda defnedilecek.",1
763,"ABD Başkanı Barack Obama, seçim kampanyasında Afrikalı - Amerikalılar için çok büyük tarihi öneme sahip bir koltuğa oturup fotoğraf çektirdi. O koltuk, 1955'te Alabama eyaletinde otobüslerde siyahların beyazlara yer verme zorunluluğuna Rosa Parks adlı <siyahi> bir kadının isyan edip yerinden kalkmayarak ırk ayrımcılığının kaldırılmasının kıvılcımını çaktığı yerdi. Obama, ""Bir an orada oturdum, Amerikan rüyasına katkıda bulunan bütün o insanları düşündüm"" dedi.",1
737,"Rihanna'nın Dior markası ile çalışmasının moda dünyası açısından farklı bir önemi var. Fransız moda devi Dior, 69 yıllık tarihinde Rihanna ile çalışarak ilk kez <siyahi> bir yüzü reklam kampanyasına taşıdı. Rihanna, Versailles Sarayı'nda gerçekleştirilen çekimde Steven Klein'ın kamerasına verdiği pozlarla şimdiden en çok konuşulan kampanyalardan birine de imza atmış oldu.",1
607,"Mustafa Tuzcu idaresindeki 28 TE 493 plakalı otomobil, Düzce TEM Otoyolu Kaynaşlı Darıyer Hasanbeyli mevkisinde, sürücüsünün direksiyon hakimiyetini <kaybetmesi> sonucu yoldan çıkarak devrildi. Metrelerce ters olarak sürüklendikten sonra durabilen otomobildeki sürücü Mustafa Tuzcu, Çiğdem, Beyza (8), Saliha (5) ve Esra Tuzcu (3) yaralandı. Çevredeki vatandaşlar tarafından otomobilden çıkarılan yaralılar, olay yerine gelen 112 Acil Servis ambulanslarıyla Düzce'deki çeşitli hastanelere kaldırıldı.",0
55,Yeni  kadrolara atanma tarihi meclisin karar tarihini takip eden <aybaşını> geçemez.,0
135,"Instagram’ın en çok takip edilen ünlü ismi Selena Gomez yeni bir rekora daha imza attı. Ünlü şarkıcının 2 hafta önce paylaştığı fotoğraf 4 milyonun üzerinde beğeni alarak rekor kırdı. Bir önceki rekor Justin Bieber’ın yine Gomez ile <birlikte olduğu> bir fotoğrafa aitti. Selena Gomez, 89 milyon takipçisiyle fotoğraf paylaşım uygulamasının en çok takip edilen ismi olmuştu. Kaynak: ( buseterim.com )",0
571,"Sur ilçesine bağlı Balılçılarbaşı semtindeki Dört Ayaklı Minare çevresinde, bir ara sokaktan çıkan iki kişi, devriye görevi yapmakta polis aracına ses bombası atarak kaçtı. Olayda herhangi bir yaralanma veya can <kaybı> yaşanmadı. Olay yerine giden takviye polis ekipleri, kaçan şahısları arama çalışmalarına başladı.",1
385,çoğu  <hakkın rahmetine kavuşmuş> gibi anlatılıyor ama öyle değil.,1
390,Birgün bisikletiyle köye gelirken de  trafik kazasında <hakkın rahmetine kavuşmuş>.,1
307,"Haberin diğer fotoğrafları için tıklayın Sırp pop şarkıcısı ve dansçı Milica Pavlovic, yeni albümünün tanıtımı için 'Ami G' adlı televizyon programına katıldı. Pavlovic, giydiği derin <göğüs> dekolteli elbiseyle dikkatleri üzerine çekti. Programa damgasını vuran 25 yaşındaki güzel, mavi renkli dekolte elbisesiyle çekilen bir fotoğrafı instagram hesabından takipçileriyle paylaştı.",1
767,"ABD'de 48 saat içinde iki <siyahi>, polis tarafından vurularak öldürüldü. Salı gecesi Louisiana Eyaleti'nde bir siyahinin vurulmasının ardından çarşamba gecesi de Minnesota Eyaleti'nde 32 yaşındaki siyahi bir genç polis tarafından vuruldu. Gencin trafik kontrolü esnasında araçta bulunan kız arkadaşının gözleri önünde vurulduğu belirtildi. Siyahi genç hastanede hayatını kaybetti. Eyalet polisi tarafından yapılan açıklamada polis memurunun zorunlu izne çıkarıldığı bildirildi. © Deutsche Welle Türkçe",1
104,"Erdoğan, Başbakanlık döneminden bu yana özellikle Cuma günleri camilerdeki ezana geç kalıyor. Erdoğan gecikince, cemaat de <bekliyor> ve namaz ile ezan gecikmeli olarak başlıyor . Erdoğan geçen hafta gittiği Kırıkkale'de de camiye 50 dakika geç kaldığı için ezan 50 dakika gecikmeli okunmuştu. Mizah dergisi Gırgır bu haftaki kapağına ezanın geç okunmasını taşıdı.",0
638,"Twitter fenomeni Fuat Avni, Bank Asya yönetimine TMSF'nin hukuksuz el koymasının ardından BDDK başkan vekili Mutalip Ünal'ın vekillik için kurnazlık yaptığını yazdı. Ali Babacan'ın da Erdoğan'ın uyarısı ve kesin emriyle her şeye sessiz kaldığını iddia etti. Bankacılık kanununda ihlal edilmedik <madde> kalmadığını yazan Fuat Avni, Erdoğan'ın Bank Asya hamlesinin ardından yaşananları yazdı. İşte Fuat Avni'nin o tweetleri;",0
175,"Azerbaycan’da bir genç kızın rüyasının etkisinde kalarak kız kardeşinin kafasını kestiği iddia edilmişti. Ancak Azerbaycan gazetelerinde yer alan bir iddiaya göre; 20 yaşındaki Günel Nuriyeva lezbiyendi, kız arkadaşlarını eve getirip <cinsel ilişkiye girdiği> için ablası ile bu yüzden sıklıkla kavga ediyordu. Günel Nuriyeva'nın annesinin yatağında ilişkiye girdiğini gören ablası Pervane Nuriyeva, ""annemin yatağını kirletme"" diyerek kız kardeşini korkunç bir şekilde katletti. Etiketler: Azerbaycan",1
595,"Acil Durumlar Bakanlığı sözcüsü, arama kurtarma ekiplerinin 14 kişiyi kurtardığını, 7 kişinin de cesedini bulduğunu açıkladı. Kazanın ardından <kaybolan> 46 kişinin bulunması için arama kurtarma çalışmaları devam ediyor. Platform, pazar günü Sahalin Adası'nın 200 kilometre açığında şiddetli fırtına nedeniyle alabora olmuştu.",0
242,"El Arabiya’nın haberine göre, beş aydır maaşlarını alamayan ve çoğunluğu yabancılardan oluşan işçiler olayı protesto amacıyla şirkete ait otobüsleri yaktı. Suudi Arabistan’da yaşanan <ekonomik> kriz Bin Ladin Grubu’nu da vurmuş ve şirket son aylarda 50 bin kişiyi işten çıkarmıştı.",0
605,"Geçtiğimiz hafta Fenerbahçe'ye 2 penaltı golüyle <kaybeden> Gençlerbirliği, Galatasaray'ı 4 - 0 gibi farklı bir skorla mağlup eden Başakşehir'i konuk etti. Ankara temsilcisi 3 puana, Tomic'in 90+6'da frikikten attığı golle uzandı. Ligin tek namağlup takımı olan Abdullah Avcı'nın öğrencileri, bu ünvanını Başkent deplasmanında korumayı başaramadı. Bu sonucun ardından Gençlerbirliği puanını 11'e yükseltirken, konuk Başakşehir ise 11 puanda kaldı.",0
528,"""Ben  de dahil herkes, Ali Kırca bu hareketiyle <iyi saatte olsunlar>'dan eksi  bir puan almıştır diye düşünüyorduk.""",0
489,"Her gün üretim var Hergün 10.00 - 17.00 arasında toplanan kadınlar, el birliği ile reçel üretiyor. Reçelden elde edilen gelir burs olarak dağıtılıyor. 14 yıldır süren burs AYDA yaklaşık 200 kavanoz reçel üreten ve kavanozunu 12.5 liradan satan kadınlar, reçellerden elde edilen gelirin ""Hacı Süleyman Efendi"" bursuna aktardıklarını belrtti. Reçel gelirleri, 14 yıldır <ihtiyaç sahibi> 60 öğrenciye aylık 70 lira tutarında burs olarak dağıtılıyor. Etiketler: Atatürkçü Düşünce Derneği",1
218,"IMF ile işbirliği askıya alınan ve Rusya ile AB arasında kalan Ukrayna, içinde bulunduğu <ekonomik> darboğazdan çıkabilecek mi? Türk Ukrayna İşadamları Derneği (TUİD) Başkan Vekili Burak Pehlivan'ın konuyla ilgili değerlendirmeleri, Avrasya Haber Portalı'nda: http: /  / www.avrasya - haber.net / ukrayna / ukrayna - da - yeni - hukumet - ve - 2013 - de - ulkeyi - bekleyen - zorluklar",0
891,"Le Monde, Lula'nın, Güney Amerika'ya yeni bir imaj verdiğini belirterek övdü. Haberde, ayrıca Lula'nın ekonomik büyümeyi ilerletirken <yoksullukla> mücadele eden dinamik, demokratik bir ülke yarattığı ifade edildi. Fransız gazetesi, ilk kez 2009'da ""y ılın adamı ""nı açıkladı. Amerikan Time dergisi de ekonomi alanında ""Büyük Buhran"" dan sonra en zor yılını geçiren ABD'de krizden çıkmak için çaba harcayan ABD Merkez Bankası (Fed) Başkanı Ben Bernanke'yi ""yılın adamı "" olarak seçmişti.",1
463,"Usta oyuncu Halit Ergenç'in  73 yaşındaki annesi İnci Aliye Yüceışık önceki akşam evinde <hayata gözlerini yumdu>. Uzun zamandır kalp tedavisi gören Yüceışık'ın ölüm haberini alan Ergenç'in çok üzğün olduğu, kendisini oyuncu eşi Bergüzar Korel'in  teselli ettiği öğrenildi. Cenaze bugün Zincirlikuyu Mezarlığı'nın içinde bulunan Zincirlikuyu Camii'nde kılınacak öğle namazını müteabiken defnedilecek.",1
78,"Beşiktaş, Fenerbahçe'yle yollarını ayıran milli sağ bek Gökhan Gönül'ü özel uçakla İzmir'den İstanbul'a getirdi. Siyah - beyazlılar, öğleden sonra Gökhan Gönül'ü İzmir'den özel uçakla İstanbul Sabiha Gökçen Havalimanı'na getirdi. Tecrübeli futbolcu ve Beşiktaşlı yöneticiler, transferle ilgili son detayları görüşmek üzere bir araya gelecekler. Son pürüzleringiderilmesinin ardından tecrübeli futbolcunun kendisini Beşiktaşlı yapan sözleşmeye imza atması <bekleniyor>. (Lig Radyo)",0
715,"Adının açıklanmasını istemeyen yetkili, ateş eden kişinin operasyonun başlangıcında Amerikan özel komandolarınca öldürüldüğünü ifade etti. Amerikalı yetkili, Usame Bin Ladin'in  yaşadığı binada yapılan hassas operasyonda karşılaşılan diğer kişilerin silah taşımadığını ve komandolar tarafından kolaylıkla <saf> dışı bırakıldığını kaydetti.",0
653,"TFF, Nelson yaşamını yitirmesinin ardından formalarının altına Mandela tişörtü giyen iki yıldızı PFDK'ya sevk etti. Sporx'in haberine göre, TFF bugün 10.20'de Drogba ve Eboue'yi Futbol Oyun Kuralları Kural 4 ve Futbol Disiplin Talimatı <madde> 45'e aykırılıktan Profesyonel Disiplin Kurulu'na sevk etti. YILDIRIM DEMİRÖREN'E ABD'DEN ŞOK...",0
462,"ANKARA  -  Arjantin Futbol Federasyonu'nun  (AFA) internet sitesinden yapılan açıklamaya göre, takımı Atletico Parana'nın Boca Unidos'a konuk olduğu karşılaşmanın 33. dakikasında aniden yere yığılan Cristian Gomez, sağlık ekibinin yaptığı müdahaleye herhangi bir tepki vermeyince hastaneye götürülmek üzere ambulansa bindirildi. 27 yaşındaki savunma oyuncusu, yolda <hayata gözlerini yumdu>. AFA, Gomez'in vefatı sebebiyle karşılaşmaların bir gün ertelendiğini duyurdu. (AA)",1
892,"Geçmişte <yoksullukla> mücadele ve insan hakları için küresel kampanyalar yürüten Kumi Naidoo, bugün çevreci örgütün yeni icra müdürü olarak görevine başladı. Naidoo, yerkürenin tümü tehdit altında olduğu sürece diğer kalkınma meseleleriyle uğraşmanın anlam ifade etmediğine dikkati çekti. Naidoo'nun yerine geçtiği Gerd Leipold, Naido'nun örgüte başkanlık edecek ilk Afrikalı ve örgüt dışından gelen ilk kişi olduğunu söyledi.",1
799,"ABD'DE yapılan araştırmaya göre, bebekleri emzikle <uyutmak>, ani bebek ölümü riskini yüzde 90 azaltıyor. Ani bebek ölümlerinin, İngiltere'de bir yaşın altındaki bebeklerde en sık rastlanan ölüm sebebi olduğu belirtiliyor. Araştırmaya göre, emzik, bebeklerin havasız kalmasını önlüyor. Bebekleri sırtüstü yatırmak, yanlarında sigara içmemek, altıncı aya kadar aynı odada yatmak da bu tür ölümleri önleyebiliyor.0",0
275,"2016’nın son konserine hareketli parçalarla başlayarak konuklarını coşturan Gökhan Tepe, 2017 yılının herkese şans ve mutluluk getirmesini diledi. 3 Aralık Dünya <Engelliler> Günü’nü de unutmayan Gökhan Tepe, ""Tüm engellilerin yaşama standartlarının daha da iyileştirilmesini yürekten diliyorum’’ dedi. Canlı performansına ‘’Demli şarkılar’’ repertuvarıyla devam eden Gökhan Tepe, konuklarının unutamayacağı bir geceye daha imza attı.",1
100,"Meteoroloji 2. Bölge Müdürlüğü yetkililerinin açıklamasına göre; 3 - 4 gün boyunca hava daha da ısınacak ve ""ekstrem"" sıcaklığa ulaşacak. 19 Nisan Salı günü termometreler 32 dereceyi gösterecek. İzmir'de nisan ayında kaydedilen en yüksek derece olan 32.5'e yaklaşması <beklenen> hava sıcaklığı, 20 Nisan'dan itibaren kuzey rüzgarları nedeniyle düşüşe geçecek. Hava sıcaklığı, gelecek 4 gün boyunca Aydın, Manisa, Çanakkale ve Balıkesir'de de mevsim normallerin üstünde olacak.",0
409,Bebek canlı  olduğundan <hamileliğini sonlandırmak> istemez.,1
650,Fikirtepe Mahallesi Mandıra Caddesi Gür Sokak üzerindeki AKP Fikirtepe İrtibat Bürosu önüne kimliği belirsiz kişi veya kişilerce atılan patlayıcı <madde> nedeniyle büroda küçük çaplı maddi hasar meydana geldi. Patlama sonrası olay yerine itfaiye ve polis ekipleri sevk edilirken Olay Yeri İnceleme ekipleri de araştırmada bulundu. Konuyla ilgili soruşturma sürüyor.,0
541,"Maden İşleri Genel Müdürlüğünde görevli olduğu öğrenilen Sedat Kahveci (34), evrak teslim etmek için bakanlığın Balgat'taki binasına geldi. Bakanlık binasının altıncı katında yangın merdivenine çıkan Kahveci, düşerek hayatını <kaybetti>. Kahveci'nin cesedi, savcılık incelemesinin ardından, otopsi için morga kaldırıldı. Sedat Kahveci'nin, daha önce uzman çavuş olarak görev yaptığı bildirildi. Olayla ilgili soruşturma sürüyor. Fotoğraf: Temsilidir",1
697,"İddialara göre, IŞİD'in Çeçen lideri Ebu Ömer El Çeçen, Suriye'de 15 adamıyla birlikte PKK'nın Suriye kolu YPG tarafından öldürüldü. IŞİD' iddia hakkında henüz açıklama yapmazken, YPG <naaşların> elinde olduğunu iddia etti. Ebu Ömer El Çeçen'in daha önce 3 defa öldürüldüğü iddia edilmişti. IŞİD'in bugün yayınladığı videoda Ebu Ömer El Çeçen'in görüntüleri yer almıştı.",1
108,"Sabah saatlerinde Maslak Acıbadem Hastanesi'ne getirilen Guti'nin , burada genel muayene ve testleri gerçekleştirildi. Guti, bu akşam BJK İnönü Stadı'nda düzenlenecek özel törende kendisini 2 yıllığına siyah - beyazlı renklere bağlayacak sözleşmeye imza atacak. Diğer yandan, sağlık kontrolü öncesi hastaneye gelen Beşiktaş Kulübü Basın Sözcüsü Mete Düren'in , basın mensuplarına esprili bir şekilde, ""Robinho'yu mu <bekliyorsunuz>?"" demesi dikkat çekti.",0
166,"Kristina Tikhonova’nın 18 Şubat’ta Moskova’dan İstanbul’a geldiği ihbarı üzerine istihbarat birimleri harekete geçti. Haberürk'ün haberine göre; Patlayıcı uzmanı 18 yaşındaki terörist kadının Dağıstan’da bulunan arkadaşlarına ""Türkiye’de kendimi patlatacağım. 2 haftaya kadar <cennete gideceğim>"" diyerek veda ettiği bilgisi de istihbarat raporlarına yansıdı. Terörist hakkında elde edilen bilgiler, 2 Mart’ta gizli yazıyla 81 kentteki birimlerle paylaşıldı. Kaynak: HABERTÜRK",1
18,-  Uykusuzluğu durdurur - Soğuk algınlığına iyi gelir - <Aybaşı> ağrılarını geçirir -  Mide bulantısını durdurur - Midedeki aşırı gazı alır Sağlık için: Yaprağı  kaynatılarak demlenir ve çayı yapılır.,1
587,"Evli ve 2 çocuk babası AKP adayı Çimen, Gümüşhane Belediye Başkanı seçildi. İktisatçı Ercan Çimen, aile şirketinde yönetici olarak görev yapıyordu. Çimen, 2009 yılında 35 oyla Gümüşhane Belediye Başkanlığı seçimini <kaybetmişti>. Gümüşhane'de 1999 yılından bu yana Belediye Başkanı olarak görev yapan MHP'li Mustafa Canlı ise bu kez ikinci sırada kaldı.",0
93,"Bağış, Genel Kurul'a gelişinde gazetecilerin, konuşup konuşmayacağı yönündeki sorusuna, ""Duruma göre bakarız"" yanıtını verdi. ""Yani konuşma ihtimali var mı?"" sorusu üzerine Bağış, ""Siyasetçinin her zaman a planı, b planı, c planı olur değil mi"" dedi. ""Nasıl bir sonuç <bekliyorsunuz>?"" sorusuna ise Bağış, ""Hayırlısı olsun takdir yüce Meclis'indir"" karşılığını verdi.",0
27,"""Kadınlar üremeleri devam etmese de devam eden  <aybaşı> kanamalarından, sıcak basmanın olmamasından memnundular.""",1
554,"Tersanedeki bir geminin bordasını yıkayan Nurettin Bingöl (36) adlı işçi, koruma halatlarından birinin kopması sonucu ters dönen vinç sepetinden aşağıya düştü. Kazada hayatını <kaybeden> 2 çocuk babası Bingöl'ün cesedi, olay yerinde yapılan incelemenin ardından Adli Tıp Kurumuna kaldırıldı. Nurettin Bingöl'ün cenazesi memleketi Niğde'ye gönderilecek. Yaşanan son ölümle birlikte, Tuzla tersaneler bölgesindeki can kaybı sayısı 136'ya yükseldi.",1
274,"Bolu Valiliği Basın ve Halkla İlişkiler Müdürlüğü'nden yapılan açıklamada, ulaşımda yaşanan zorluklar nedeniyle il genelindeki kamu kurumlarında çalışan <engelli>, hamile memur ve diğer kamu görevlilerinin aynı gün idari izinli sayılacağı belirtildi. 100.000  Sanal Para ve Eğitim Rehberi ile Forex’i Ücretsiz Öğrenin! 2016 Yılı 4.Çeyrek Kâr / Zarar Oranı: %18  /  %82 Etiketler: Bolu , memur , Gerede",1
305,"Erkek müşteri şifresini ATM'ye girdikten sonra kadınlardan biri <göğüslerini> açıyor, diğerleri de bu arada paraları alarak kaçıyordu. Fransız polisi hırsızların Paris'te bir banka şubesinde güvenlik kameralarınca görüntülendiğini ancak kadınların kimliğinin tespit edilemediğini söyleydi. Polis sözcüsü, ""Para çekenlere manzara ne kadar çekici olursa olsun makinelere odaklanmalarını öneriyoruz"" dedi. (Vatan)",1
49,"""Kadın sadece üre ve <aybaşı> kanamasına yetecek kadar,  kibrit çöpü çapında bir açıklık bırakmıştı.""",1
41,Kabakulak  otu adı altında idrar artırıcı ve <aybaşı> kanamalarını düzenlemek üzere önerilen bitkinin  Latince karşılığını gördüğümde endişelendim.,1
