num,text,label
313,"Bella Hadid, geçtiğimiz hafta ""Bu kadar kilo vermek istememiştim. <Göğüslerimi> ve kalçalarımı geri istiyorum"" ifadelerini kullanmıştı. 20 yaşındaki güzelin, kendisi gibi ünlü bir manken olan ablası Gigi Hadid'in vücudunu kıskandığı ortaya çıktı. Rapçi sevgilisi The Weeknd'den ayrılan Bella, depresyona girdiği öne sürüldü. (Posta)",1
536,"Saldırının kınandığı, birlik ve beraberlik çağrısı yapılan açıklama şöyle: ""Ankara’da bugün meydana gelen terör saldırısını şiddetle kınıyor, hayatını <kaybedenlere> Allah’tan rahmet, yaralılara acil şifalar diliyoruz. Demokratik hukuk devletine, milletimizin birlik ve dirliğine kasteden bu hain saldırı karşısında insanımızın sağduyuyla ve her zamankinden daha güçlü şekilde dayanışma içinde olacağına inanıyoruz. Milletimizin başı sağolsun.""",1
519,"""Aynı <ince hastalık> gibi derinden , sessizce sardın beni, O yürekki artık hayalinle bitap, zorda , Hastalığımsın anladım, mücadelem yok sana... İtiraf denen bozguncu,  rehin aldı beni.""",1
474,"İskoçya’nın en büyük kulüplerinden Glasgow Celtic, çok özel bir harekete imza attı. Daha önce başta Filistin olmak üzere Suriye, Irak ve Afganistan’daki çocuklara yardımda bulunan Celtic, şimdi de fakir aileler için bir proje başlattı. İskoç taraftarlar yaptıkları kampanya ile hazırladıkları kıyafetleri ve evlerindeki yiyecekler Celtic Park önüne getirip, <ihtiyaç sahiplerine> dağıttı.",1
365,"Ankara Çankaya'da Şehit Mustafa Doğan Caddesi'nde başlatılan kaldırım bakım onarım çalışmasında <görme engellilerin> ulaşımlarını sağlayabilmeleri için hazırlanan şeritlerden kullanıldı. Ancak şeritlerin görme engelli yurttaşları bir yere ulaştırmadığı aksine desen olarak kullanıldığı görüldü. Kaldırıma dik döşenen şeritler Ankaralıların tepkisini toplarken, Belediyeye ve Belediye Başkanı Melih Gökçek'e tepki yağdı.",1
149,"Şubat ayında nişanlanıp temmuzda aşk bitti' diyerek yüzükleri atan oyuncu Pelin Öztekin ile Kıvanç Baran Arslan çifti, 3 aylık ayrılığın ardından yeniden <birlikte olmaya> başlamıştı. İkili, önceki akşam Kuruçeşme'de ortaya çıktı. Çift, müjdeli haberi verdi: İlişkimiz çok güzel gidiyor. Bu yaz başında evleneceğiz.",0
297,"EKONOMİ SERVİSİ <Gelişmekte olan ülke>lere ait 50 milyar dolarlık varlık yöneten Franklin Templeton Fonu’nun yöneticisi olan Mark Mobius (77), kötü günlerin henüz geride kalmadığı yorumunda bulundu. Bloomberg’e konuşan Mobius, ""Olumsuz algı hâlâ yerli yerinde. O yüzden daha çok satış bekleyebilirsiniz"" dedi. Öte yandan Harvard Üniversitesi Profesörü Kenneth Rogoff’a göre ise gelişmekte olan ülke piyasaları korkulduğu kadar kırılgan değil. Etiketler: Harvard , Harvard Üniversitesi",1
103,"* Soma maden faciasının birinci yıldönümünde, yalnız bırakılan çocukların travması daha yeni başlıyor. * Karikatürist Selçuk Erdem: Biz de sürekli Erdoğan çizmeye bayılmıyoruz. * Kapanmayan inşaat iştahı nedeniyle, İstanbul’un Karadeniz kıyısındaki 50 köy daha tarihe karışmayı <bekliyor>. * The Avengers’ın gişe rekoru bir kez daha ilan etti: Sinemadan para kazanmak istiyorsan süper kahramanın olacak.",0
5,"İbrahim Hacıosmanoğlu döneminde yönetime giren Çakıroğlu’nun cenazesi bugün ikindi vaktinde İstanbul Pendik Merkez Camii’nde kılınacak cenaze namazı sonrasında son yolculuğuna uğurlanacak. Bordo - mavili kulübün mesajında, ""Uzun süredir <amansız hastalıkla> mücadele eden Çakıroğlu, maalesef hayata tutunamadı. Merhuma Allah’tan rahmet, kederli ailesine sabır diliyoruz. Camiamızın başı sağ olsun"" denildi.",1
570,"11. Cumhurbaşkanı Abdullah Gül, Ankara'daki terör saldırısı için Twitter hesabı üzerinden bir açıklama yaptı. ""Ankara'daki hain terör saldırısını lanetliyorum. Aziz milletimize başsağlığı diliyorum"" diyen Gül, ""Hayatını <kaybedenlere> Allah'tan rahmet, yakınlarına başsağlığı ve yaralılara acil şifalar diliyorum"" ifadelerini kullandı ve 'birarada durma' çağrısı yaptı. Gül, ""Görüşü ve düşüncesi ne olursa olsun, herkesi teröre karşı tavizsiz bir şekilde birarada durmaya davet ediyorum"" dedi.",1
492,"IHA Tekirdağ merkez ilçe Süleymanpaşa Belediyesi tarafından Ramazan ayı boyunca yaklaşık bin 500 kişiye erzak yardımı yapıldı. Muhtar aracılığıyla belirlenen <ihtiyaç sahibi> vatandaşlar, erzak yardımı yapılarak Ramazan ayında yüzleri güldürüldü. Süleymanpaşa Belediyesi tarafından yapılan yardımların doğru yere ulaşması için 'Bir elin verdiğini diğer elin görmemesi' mantığıyla yapıldığı belirtildi. Etiketler: Tekirdağ , Ramazan , Tekirdağ Haberleri « önceki haber sonraki haber »",1
558,"Kanser tedavisi gördüğü hastanede dün hayatını <kaybeden> sanatçı Murat Göğebakan, son yolculuğuna uğurlandı. Cenaze törenine Başbakan Recep Tayyip Erdoğan yanı sıra sanatçılar, Göğebakan'ın yakınları ve sevenleri katıldı. Cenaze töreninin ardından Erdoğan, Göğebakan'ın tabutuna omuz verdi. Fatih Camii'nde kılınan cenaze namazın ardından Göğebakan'ın cenazesi toprağa verilmek üzere Adana'ya gönderildi. MURAT GÖĞEBAKAN'A VEDA - FOTO GALERİ",1
803,"SUAT DENİZ Iğdır DHA İnekleri borçlanarak aldığını anlatan çiftçi Bağcı, şöyle konuştu: ""Hırsızlar, gece yarısı tel örgüleri keserek bahçeme girmiş. Köpeklere de ilaç verip <uyutmuşlar>. Tek geçimim bu ineklerdi. Ne yapacağımı şaşırdım. Bu da yetmez gibi yavrularına her gün 10 kilo süt alıp içiriyorum. Evimin geçim kaynağı olan ineklerimin bulunmasını istiyorum."" Etiketler: Iğdır",0
405,"""Böylece hem gerekli olabilecek müdahale için geç kalınmamış olacak,  hem de eğer kalple ilgili anomali onarılamayacak kadar ağırsa <hamileliğin sonlandırılması> sözkonusu  olabilecektir.""",0
285,Erkek  <fındık kırarsa> bu Uçarılık olur.,1
54,"""Ay'ın evreleri ile cinayetler, kazalar , dünyamızda oluşan kasırgaların dağılımı, magnetik alanlarda bozulma, kadınların <aybaşları>  ve sara nöbetleri arasındaki ilişkileri yakından takip ediyorlar, devamlı istatistiki bilgi  topluyorlar.""",1
586,Boğaziçi Üniversitesi Kandilli Rasathanesi ve Deprem Araştırma Enstitüsü Bölgesel Deprem - Tsunami İzleme ve Değerlendirme Merkezi'nden edinilen verilere göre merkez üssü Balıkesir'in Bigadiç ilçesinde 3.5 şiddetinde bir deprem meydana geldi. Saat 16.52'de 5.4 kilometre derinlikte meydana gelen depremde can ve mal <kaybı> yaşanmadı.,0
652,"Ataşehir'de ünlü bir lokantada geçen cumartesi günü meydana gelen Avukat Işıl G.'nin 3 yaşındaki oğlu Y.K.'nin oyun yerinde üzerine asitli bir <madde> atılması olayı öncesinde başına başka bir talihsizliğin daha geldiği ortaya çıktı. Minik Y.K.'nin, daha önce de evinde uzaktan kumandalı oyuncak arabasının patladığı ve yaralandığı öğrenildi. Asitli saldırgan aileden",0
314,"Haberin diğer fotoğrafları için tıklayın Eşi Kanye West ile akşam yemeğine çıkan Kim Kardashian, bir kez daha stili ile Gündem olmayı başardı. Baştan aşağı beyazlara bürünen ABD'li yıldız, beyaz mini bir jean etek ve derin <göğüs> dekolteli beyaz bir bluz giydi. Pembe tonlarında şeffaf ayakkabılarıyla görünümünü tamamlayan Kardashian, üzerine yerlere kadar uzanan beyaz bir ceket aldı.",1
301,"Çağla Şikel’in geçen hafta ""Her Şey Dahil"" programında dans ederken <göğsü> açılmıştı. Çok konuşulan bu canlı yayın kazası, Youtube'da ‘En Popüler Video’ kategorisinde yer aldı ve 1 milyon kez izlendi. AVUKATI DEVREDE Vatan'dan Gülşen Yüksel'in haberine göre, Görüntülerden çok rahatsız olan 2 çocuk annesi Şikel, 40’ın üzerinde internet sitesinde yer alan videolarla ilgili harekete geçti. Avukatına talimat vererek görüntülerin kaldırılmasını talep etti.",1
530,"""Hemen her televizyon kanalında yayınlanan, sır’lı, esrar’lı , gizem’li gerçeküstü hikayeleri izleye izleye, <iyi saatte olsunlar>’a karışmıştık anlaşılan  milletçe!""",1
863,"Hırvatistan Milli Futbol Takımı'nın kaptanı Darijo Srna'nın babası Uzeir Srna, kanser hastalığına yenik düştü ve yaşamını yitirdi. Rahatsızlığı nedeniyle bir süredir hastanede tedavi gören Uzeir Srna, Türkiye ile Hırvatistan arasında oynanan maç esnasında <vefat etti>. Türkiye karşısında 90 dakika boyunca mücadele eden Srna, babasının ölümünü maçın ardından öğrendi.",1
750,"AA Edinilen bilgiye göre, Chicago polisi, kentin güneyinde aile içi şiddet ihbarı üzerine gittiği binada mühendislik fakültesi öğrencisi 19 yaşındaki Quintonio LeGrier ve 55 yaşındaki Bettie R. Jones’u silahla vurarak öldürdü. Yapılan açıklamada, gencin tehlike oluşturması üzerine vurulduğu, kadının ölümünün ise ""kazara"" meydana geldiği belirtildi. İki kurbanın da <siyahi> ve silahsız olduğu ifade edildi. Etiketler: ABD",1
871,"Faciada yaşamını yitiren Tezcan Gökçe’nin ailesine 349 TL aylık bağlayan Sosyal Güvenlik Kurumu (SGK), ""Oğlum yüzme bilmezdi, suyun içinde ne yaptı"" diyerek acının simgesi olan annesi Ayşe Gökçe ve yırtık lastik ayakkabılarıyla yürekleri dağlayan babası Recep Gökçe’ye de 140’ar TL’lik <yoksulluk> yardımı bağladı. Tezcan Gökçe’nin, çalıştığı Has Şekerler Madencilik’te asgari ücret üzerinden primi yatırıldığı için annebabasına bağlanan yoksulluk yardımının düşük seviyede kaldığı vurgulandı.",1
92,"Uzmanlar Merkez Bankası'nın dünkü toplantısından 25 baz puanlık bir indirim <beklerken>, 50 baz puanlık indirimi sürpriz olarak nitelendirdi. Merkez Bankası'nın kararının ardından dün akşam uluslararası piyasalarda dolar / TL kotasyonları hafifçe yükselirken bugün de benzer bir etki izleniyor. Dolar, yurtdışı borsalardaki düşüşlerin de etkisiyle ilk işlemlerle birlikte 1.5480 liraya çıktı.",0
312,"Maslak Acıbadem Hastanesi’ndeki ameliyatın ardından bir hafta tedavisine devam edilen modacıya çıkışta menajer Stelyo Pipis eşlik etti. Basın mensuplarının ilgi gösterdiği Yerlitaş, ""Herkese çok teşekkür ediyorum. Her kadının <göğüs> kontrollerini yaptırmasını istiyorum"" dedi. Yüzlerce geçmiş olsun mesajı alan Yerlitaş’ın, sosyal medya hesabından ""Kır dümeni kaptan, aydınlık sabahlara... Güzel insanlara, mutlu yarınlara"" diye yazması dikkat çekti.",1
899,"Şubat 2010'dan sonraki askeri darbenin ardından sivil iktidarın tesisi için yapılan seçimde, cunta lideri General Salou Djibo, başkent Niamey'deki oy verme merkezinde oy kullandı. Önemli bir uranyum üreticisi olmasına rağmen dünyanın en <yoksulları> arasında bulunan ülkede, yaklaşık 6,7 milyon seçmenin oy kullanması bekleniyor.",1
602,"Afet İdaresi yetkilileri, sellerde birkaç kişinin de <kaybolduğunu> belirtti. Seller yüzünden bazı evlerin yıkıldığı ve alt yapının hasar gördüğü kaydedildi. Arama ve kurtarma çalışmalarının geçen yılki sel felaketinde hasar gören ve henüz onarılmayan köprü ve yollar yüzünden güçlükle yürütüldüğü bildirildi. Şiddetli yağışın bölgede 24 saat daha süreceği tahmin ediliyor. Pakistan'ı geçen yıl tarihinin en kötü sel felaketi vurmuştu.",0
512,Zevk için seks yapan <iki canlı> türü var : İnsan ve yunus.,0
722,"C vitaminin en <saf> hali… Kırışıklık ve leke giderici etkisi FDA tarafından onaylanmış Annagaspi C vitamini ampulü kolajen üretimini artırır, antioksidan gibi çalışır. Cilt tarafından eşit oranda emildiğinde toksik maddeleri uzaklaştıran yoğunlaştırılmış Vitamin C leke giderici ampul, hücre duvarının korunması, hücre yaşlanmasının önlenmesi, cilde nem ve esneklik kazandırılmasında önemli bir rol oynar. Fiyatı: 96 TL",0
491,"İZMİR Milliyet Firma, piyasaya sunduğu yepyeni ürünleriyle sektördeki yerini sağlamlaştırırken gelişmiş teknolojili ürün özellikleriyle de <ihtiyaç sahiplerine> büyük kolaylıklar sağlıyor. ‘Hermetik Doğalgazlı Şofben’, ‘ECS Üç Geçişli Çelik Gövdeli Kalorifer Kazanı’ ve ‘Euromat EKY / S Serisi Otomatik Sürücülü Kat Kaloriferi’yle sınıfının en üstün özellikli ısıtma sistemlerini piyasaya süren Termodinamik, sektörde devrim yaratmaya hazırlanıyor. Etiketler:",0
36,"""Istakoz işine  giren sosyetenin kamberi Sema Çelebi, <aybaşında> iş görüşmeleri için Amerika'ya gitmiş .""",0
506,• Teorik olarak <iki canlı> aşı ya  aynı anda yapılmalı ya da aralarında en az 1 ay olmalıdır.,1
734,"""Bizleri habire bölüp parçalayacaklar:  evli - bekar, bakire - bakire değil, evkadını - <seks  işçisi>... Suçlar hep bu bölünmelere bağlı değişik tarifelerle cezalandırılacak.""",1
452,"Nilüfer’in uzun zamandır alzheimer hastası olan annesi Zeynep Lütfiye Yumlu, 97 yaşında <hayata gözlerini yumdu>. Anne Yumlu’nun cenazesi bugün Çengelköy ’deki Kerem Aydınlar Camii’nde öğle namazına müteakiben kılınacak cenaze namazının ardından Edirnekapı Mezarlığı’nda toprağa verilecek. Önceki gün Vodafone FreeZone’un düzenlediği 17. Liselerarası Müzik Yarışması’nın final gecesi sahneye çıkacağı açıklanan Nilüfer annesinin vefatından dolayı törene katılamadı.",1
675,"""Günümüzde hem <mercimeği fırına vermek> daha kolay, hem de  fırında makarna yemek... Türkiye son beş yıldır kamu kesiminde GSMH'nin yüzde  6,5'i seviyesinde faiz dışı fazla hedefliyor.""",0
339,"Ayazaağa Mahallesi Şehit İlhan Yurt Sokak'ta, gece saatlerinde bir apartmanda silah sesi duyan vatandaşlar, binanın girişinde hareketsiz yatan genci gördü. Olay yerine polis ve sağlık ekipleri sevk edildi. Silahla <göğsünden> vurulduğu belirlenen 17 yaşındaki D.Ş, kaldırıldığı Maslak Acıbadem Hastanesi'nde müdahaleye rağmen kurtarılamadı. Olayla ilgili 2 kişinin ifadesine başvuruldu. Soruşturma sürdürülüyor.",0
723,"NATO'nun öncülüğündeki Uluslararası Güvenlik Destek Gücü (İ<SAF>) tarafından yapılan açıklamada, Afganistan'da düzenlenen ""çoklu karmaşık (bombalı) saldırılarda"" Amerikan askerlerinin yanı sıra bir Afgan sivilin öldüğü, yaralananların da bulunduğu belirtildi. Saldırılarla ilgili ayrıntı verilmedi. Bu son ölümlerle ekim ayının, 8 yıllık savaşta Amerikan askerleri için en kanlı ay olduğu belirtildi. Bu ay Afganistan'da ölen Amerikan askerlerinin sayısı 55'e çıktı.",0
526,"Ölçme, Seçme ve Yerleştirme Merkezi(ÖSYM), 2012 Öğrenci Seçme ve Yerleştirme Sistemi (ÖSYS) Kılavuzu'nun, görme ve <işitme engelli> adaylar için sesli ve görüntülü olarak hazırlanmasını tamamladı. ÖSYM'nin hazırladığı kılavuz, görme engelli adaylar için sesli ve işitme engelli adaylar için işaret dilinde video görüntüsü olarak hazırlandı. Video görüntülerine ""http: /  / www.osym.gov.tr"" adresinden ulaşılabilecek.",1
393,"""Gerçi Al Capone 1947'de  <hakkın rahmetine kavuştu> ama ne tanrı'nın, ne de Amerikan gangsterlerinin çalışma  tarzı açısından pek bir şey değişmiş değil; misal, Amerikalıların canı  daha fazla petrol istediğinde herhangi bir ülkeyi talan edebiliyorlar.""",1
611,"İddialara göre, ilçeye bağlı Bahçelievler Mahallesi'nde kendisine ait binanın devam eden inşaatını inceleyen Adnan Kart (57), bu sırada dengesini <kaybederek> ikinci kattan zemine düştü. Ağır yaralanan Kart, kaldırıldığı Cihanbeyli Devlet Hastanesi'nde tüm müdahalelere rağmen kurtarılamadı. Geçtiğimiz Mart ayında CHP Cihanbeyli İlçe Başkanı seçilen Kart, evli ve 2 çocuk babasıydı.",0
881,"Devlet Başkanı Dilma Rousseff, ülkenin 80 bölgesinde en <yoksul> okullara gönderilecek 30 bin bisikletin teslim törenine katıldı. Program çerçevesinde yıl sonuna kadar 100 bin adet bisiklet dağıtılması öngörülüyor. Eğitim Bakanı Fernando Haddad, ""Okul Yolu"" programının en ücra bölgelere ulaşmak için okul otobüsleriyle 2007'de başlatıldığını, ardından gemiler alındığını anlattı. Bakan Haddad, ""Şimdi de sıra bisiklette"" ifadesini kullandı.",1
777," - BACA PERU KÜLTÜR BAKANI OLDU LİMA (A.A)  -  26.07.2011  -  Peru'de Devlet Başkanlığına seçilen Ollanta Humala, ünlü şarkıcı Sisana Baca'yı Kültür Bakanı olarak seçti. ""Lamento Negro"" albümüyle 2002'de Latin Grammy ödülü alan 67 yaşındaki Baca, ülkenin İspanya'dan bağımsızlığını kazandığı 1821'den bu yana ilk <siyahi> bakanı oldu. Devlet başkanlığı görevine resmen Perşembe günü başlayacak Humala, Eğitim Bakanlığına da sosyolog Patricia Salas'ı getirdi.",1
412,"İngiliz futbolcu David Beckham'ın  idari işlerini yürüten firmadan yapılan açıklamada, futbolcunun <hayat kadınlarıyla> cinsel ilişkiye girdiği iddiasını haber yapan haftalık ""In Touch"" adlı dergi hakkında yasal yollara başvurulacağı bildirildi. Açıklamada, ABD'de yayımlanan dergide yer alan iddiaların tamamen asılsız ve gülünç olduğu belirtildi, ""Maalesef dergilerin, yalan üzerine kurulu haber yapabildiği ve bundan sıyrılabileceğini düşündüğü bir dünyada yaşıyoruz"" ifadesi kullanıldı.",1
810,"RADİKAL  -  ABD ’de 9 Mart tarihinde beyin ameliyatı olan ve uzun süre yoğun bakımda <uyutulan> İbrahim Tatlıses, sevenlerini korkutmuştu. Yoğun bakımdan çıkan Tatlıses, önümüzdeki günlerde İstanbul ’a dönecek. Hastanede bir an olsun babasını yalnız bırakmayan oğlu İdo Tatlıses, ünlü sanatçının ameliyat sonrası ilk fotoğrafını paylaşarak "" şimdi sıra sakalda’ notunu düştü.",0
323,"Inna Şevçenko adlı Ukraynalı Femen kadını, Teksas'ta uygulanan kürtaj yasağını protesto etmek için Austin Belediye Binası'nın önünde soyunarak elindeki İncil'i parçaladı. Femen kadını çırılçıplak soyunup İncil'i parçaladı  -  VİDEO Kürtaj yasağının ardında dini gerekçeler yattığını belirten Femen üyesinin <göğsünde> ""Sizin İncil'iniz benim vajinamı kontrol edemez"" yazdığı görüldü.",1
430,"Kalp rahatsızlığı nedeniyle uzun süre tedavi gören 27 yaşındaki Gülen Yerlikaya'nın bu sabaha karşı <hayata gözlerini yumduğu> öğrenildi. Gülen Yerlikaya'nın cenazesi, İstanbul Bağlarbaşı'daki Marmara Üniversitesi İlahiyat Fakültesi Camii'nde, ikindi namazını müteakip kılınacak cenaze namazının ardından, Küçükbakkalköy'de toprağa verilecek.",1
79,"Beşiktaş Teknik Direktörü Şenol Güneş, yarın saat 12.00'de Ümraniye'deki BJK Nevzat Demir Tesisleri'nde basın toplantısı yapacağını açıkladı. Dün yayıncı kuruluşa konuşan ve yönetimi epey eleştiren Güneş'e yakın çevreler, deneyimli hocanın göreve devam edip etmeme konusunda bir açıklama yapmasının <beklendiğini> ifade ettiler.",0
433,"İstanbul Acıbadem İnternational Hastanesi'nde bir süredir tedavi gören Ali Osman Ulusoy, bugün sabah saatlerinde <hayata gözlerini yumdu>. Grip olduğu gerekçesiyle 3 hafta önce Trabzon'da hastaneye getirilen Ulusoy, tedavi için İstanbul'a götürülmüştü. Trabzon'un önde gelen iş adamlarından Ulusoy, yapılan tüm tedavilere rağmen hastalığa direnemedi. Ulusoy, yarın ikindi namazına müteakip kılınacak cenaze namazının ardından Trabzon'un Of ilçesinde aile kabristanlığına defnedilecek.",1
366,"Altınokta Körler Derneği'nden yapılan açıklamaya göre, <görme engellilerin> sorunları için çalışan, bu alanda birçok yenilik getiren Altınokta Körler Derneğinin 31. Olağan Genel Kurulu yapıldı. Yeni dönem başkan ve yöneticilerinin seçildiği kongrede, Genel Başkanlığa Suha Sağlam yeniden seçildi.",1
601,"Polis memuru Faruk Ahmed, yoldan çıkan otobüsün, bölge başkenti Muzafferabad'a yaklaşık 60 kilometre uzaklıktaki Reelam Nehri'ne yuvarlandığını belirtti. Yoldaki koyun sürüsünden kaçmak isteyen şoförün otobüsün kontrolünü <kaybetmiş> olabileceğini kaydeden Ahmed, kazayla ilgili soruşturma başlatıldığını söyledi.",0
253,"Bolu Valiliği yoğun kar yağışının devam etmesi üzerine yarın il genelinde ilk ve orta dereceli okulları bir gün süreyle tatil etti. Ayrıca, kamu kurum ve kuruluşlarında çalışan <engelli> ve hamile çalışanlar yarın (Salı) idari izinli sayılacaklar.",1
808,"AVUSTRALYA'DA yeni bir teknikle yapılan beyin ameliyatında hastaya dünyada ilk kez genel anestezi uygulanmadı, hatta operasyon sırasında bilinci açık olan hasta, doktorlarla konuştu. Beynindeki anevrizmanın kör etme tehlikesi karşısında <uyutulmayan> hasta John James, Canberra Hastanesi'ndeki operasyonda doktor ve hemşirelerin konuşmalarını dinlemenin ilginç bir deneyim olduğunu söyledi.0",0
807,"AA Denizli Devlet Hastanesi Yoğun Bakım Servisi’nde şiddetli ağrıları nedeniyle <uyutularak> tedavisi devam eden Didem Fazlı’nın 8 aylık bebeği, dün 14.30 civarında anne karnında yaşamını yitirdi. Fazlı’nın sağlık durumunun ciddiyetini koruduğu, bu arada ölen bebeğin kadın doğum uzmanlarınca belirlenecek zamanda anne karnından tahliyesinin yapılacağı bildirildi. Etiketler: sağlık , Temmuz , Denizli",0
562,"Edinilen bilgiye göre, Mescit Mahallesi’ndeki polis merkezine bir grup terörist tarafından iki tane el yapımı bomba atıldı. Saldırıda herhangi bir yaralanma ve can <kaybı> yaşanmazken emniyet güçlerinin saldırıya karşılık vermesinin ardından teröristlerle polis arasında çatışma yaşandı. Kurdukları barikatların altına patlayıcı yerleştirerek ara sokaklara kaçan teröristlerin yakalanması için bölgede çalışma başlatıldı.",1
787,"Liv Hospital Başhekimi Op. Dr. Adil Tanık, ""Oya Hanım'ın kanaması durdu. Tansiyonu kabul edilebilir seviyeye indirildi. Ama beyninde aşırı ödem, sol tarafında güç kaybı var. 48 saat daha <uyutulacak>"" dedi. Prof. Dr. Ahmet Özkara da ""Aort damarı yırtıkları ölüme yol açabilir. Hastamızın hemen buraya ulaştırılması yaşama şansını artırmıştır"" diye konuştu.",0
141,"Ayşe Erbulak uzun yıllardır <birlikte olduğu> Özden Özgürdal ile Maltepe Evlendirme Dairesi’nde evlendi. Oyuncu Gamze Gözalan, Özden Özgürdal’ın nikah şahitliğini yaparken Ayşe Erbulak’ın şahitliğini ise oğlu Dağhan Külegeç ve kız kardeşi Nilgün Kuruöz yaptı. Ünlü çift balayına İtalya'ya gidecek.(Vatan)",0
497,"IHA Haberin diğer fotoğrafları için tıklayın Ağrı Samerkard Vakfı, <ihtiyaç sahipleri> yararına kermes açtı. Samerkard Vakfı tarafından Vali Konağı Caddesinde açılan kermeste, giysi, çeyizlik, ayakkabı, yiyecek, ev eşyaları satışa sunuldu. Samerkard Vakfı, kermesin geliri ihtiyaç sahipleri yararına kullanacak. Etiketler: Ağrı , Ağrı , Ağrı Haberleri « önceki haber sonraki haber »",1
703,"Gazetemiz yazarlarından Bağış Erten'in babası, hukukçu ve emekli hakim Ruşen Eşref Erten yaşamını yitirdi. Merhumun <naaşı> yarın ikindi namazına mukabil Zincirlikuyu mezarlığında son yolculuğuna uğurlanacak. Cumhurriyet ailesi olarak Erten Ailesi'ne sabır ve başsağlığı diliyoruz.",1
280,"<Engellilerin> yaşadıkları sıkıntıları, yapmış oldukları kartpostallar ile dile getiren minikler, ailelerinin de bu konuya duyarlı olmalarını sağladılar ve kendi harçlıkları ile ailelerinin bağışlarını birleştirerek dernek yetkililerine sundular. Dernek başkanı Kemal DEMİREL çocuklarımızın bu duyarlı davranışları için kendilerine teşekkür etti. Etiketler: anakent , Anakent İlkokulu , engelli ,",1
625,",Oyuncu Düzyatan, İstanbul 27. Sulh Ceza Mahkemesi’nde, kullanmak için uyuşturucu ve uyarıcı <madde> satın almak ve bulundurmak suçundan 2 yıla kadar hapisle yargılandığı davadan beraat etti. Engin Altan Düzyatan'ın şahıslara esrar kullanılması için yer temin ettiği iddia edilmiş ayrıca esrar almak için kendisi gidemediği zaman şoförünü gönderdiği öne sürülmüştü.",1
621,"Pakistan Ulusal Sağlık Kurumu (NHD) yaptığı açıklamada, doğudaki Pencap eyaletinde hayatını kaybeden 15 kişiyle birlikte ülke genelinde bugüne kadar 195 kişinin dang hummasına <kurban gittiğini> bildirdi. NHD, yüksek ateş ve şiddetli kas ağrısından şikayetçi olanların acilen hastanelere başvurması ve sivrisineklerden korunması çağrısını yenilesi. Kurum, ülke genelinde durumu ağır 200'e yakın kişinin tedavi altında olduğunu, 13 binden fazla kişin de dang virüsü taşıdığını açıkladı.",1
342,"Aralarında Jüri Başkanı Kadir İnanır'ın  da bulunduğu Ulusal Uzun Metrajlı Film Yarışması'nın jüri üyelerini Antalya Havaalanı'nda, Antalya Büyükşehir Belediyesi Genel Sekreteri Mehmet Rıfkı Alptekin'in  yanı sıra, sanatçılar Sümer Tilmaç ve Coşkun <Göğen> karşıladı. Havalimanındaki yurttaşlar, Jüri Başkanı Kadir İnanır'a büyük ilgi gösterdi.",0
373,"""Heyetin başkanı, şimdi <Hakk'ın rahmetine kavuşmuş> olan Yusuf  Serveroğlu Bey'dir.""",1
