num,text,label
264,"Zürih’te devam eden 22. Avrupa Atletizm Şampiyonası, erkekler 3000 metre <engelli> finalinde Fransız atlet Mahiedine Mekhissi Benabbad’ın kendisini altın madalyadan eden ‘skandal’ hareketiyle sarsıldı. FORMASINI ÇIKARTTI Erkekler 3000 metre engelli finalinde 8.25.30’luk derecesiyle birinci gelen Benabbad, yarışın son metrelerinde formasını çıkardığı için diskalifiye edildi.",0
674,"Uygulama kapsamında ekipler 39 ilçede, 5 bin polisin katılımıyla denetimlerde bulundu. 122 farklı noktada yapılan denetimlerde polis ekipleri şüpheli görülen araçları durdurdu. Araçları didik didik arayan ekipler, sürücü ve yolcuları Genel Bilgi Taraması'ndan (GBT) geçirdi. Gece geç saatlere kadar süren uygulamada bazı kişilerin üzerinde uyuşturucu <madde> ele geçirildi.",0
450,"Kadir’in Büyükçekmece Yeni Mezarlık’taki kabri başında yapılan anmaya, arkadaşımızın ailesi, yakınları, Milliyet çalışanları ve sevenleri katıldı. Anma töreni okunan duaların ardından sona erdi. Milliyet’te sayfa sekreteri olarak görev yapan arkadaşımız, yakalandığı hastalığa yenik düşerek 10 Mart 2013’te 28 yaşında <hayata gözlerini yummuştu>. Etiketler: Büyükçekmece",1
215,"Küçükçekmece'de oturan S.Ç, bazı yayın organlarında Terör örgütü propagandası yapıldığı iddiasıyla savcılığa suç duyurusunda bulundu. Suç duyurusunu değerlendiren Anadolu Cumhuriyet Başsavcılığı, bu kapsamda Samanyolu Haber ile Mehtap TV hakkında soruşturma başlattı. Örgütlü, Kaçakçılık ve <Ekonomik> Suçlar Soruşturma Bürosunca yürütülen soruşturma kapsamında, söz konusu televizyon kanallarındaki yayınlar incelenecek.",0
35,"""Bronşit selülit , saç, <aybaşı>, güneş yanması, yüksek tansiyon, ödem , romatizma gibi rahatsızlıklara iyi gelmektedir.""",1
242,"El Arabiya’nın haberine göre, beş aydır maaşlarını alamayan ve çoğunluğu yabancılardan oluşan işçiler olayı protesto amacıyla şirkete ait otobüsleri yaktı. Suudi Arabistan’da yaşanan <ekonomik> kriz Bin Ladin Grubu’nu da vurmuş ve şirket son aylarda 50 bin kişiyi işten çıkarmıştı.",0
874,"Küba'nın eski lideri Fidel Castro, resmi bir internet sitesinden yayınlanan demecinde, ABD Kongresi'nin, devasa büyüklükteki askeri harcamaları kısa sürede onayladığını, ancak <yoksul> Amerikalıların sağlık hizmeti almasına yönelik reformu halen onaylamadığını, kongre üyelerinin kesinti istediğini kaydetti. Fidel Castro, 50 milyon Amerikalının sağlık hizmeti alamadığını belirtirken, kendi ülkesinde ise bu hizmetin tamamıyla ücretsiz olduğunu da vurguladı.",1
727,"""Tıpkı Mahnaz Afsali'nin , tamamı bir kadınlar tuvaletinde geçen; evlerinden kaçan kızların, uyuşturucu  satıcıların, <seks işçisi> kadınların peçelerini çıkardıktan sonra bir ve aynı oldukları  şiirsel filmi Hanımlarda olduğu gibi.""",1
429,"Dursun büyük bir sitede bekçilik yapan bir adamdır. Bir <hayat kadınıyla>, onun AİDS olduğunu bilerek beraber olur. Site yöneticisi hastalığını öğrenince işine son verir. O da ölümü beklemek yerine ölüme gitmeyi tercih eder. Deniz kıyısında bir çuval taşa bağlı şekilde hayatına son verecekken taş onu yeniden hayata bağlar. Dursun zamanla bir seri katile dönüşür. Bir süre sonra işlediği cinayetlerinde ona bir haz vermediğini anlar. Etiketler: seri katil , katil , bekçi , Bir ,",1
907,"Resmi rakamlara göre kuraklık ve gıda fiyatlarının yükselmesi gibi nedenlerden dolayı Etiyopya'da 6,4 milyon kişinin ""acil yardıma"" gereksinim duyuyor. 13,5 milyon kişiye yardım gerektiğini aktaran Oxfam'ın yöneticisi Velid Rauf, açlık ve <yoksulluk> oranının ilerlediğini hatırlattı.",1
444,"IHA 91 yaşında <hayata gözlerini yuman> Türkiye’nin dokuzuncu cumhurbaşkanı Süleyman Demirel’in cenazesi, doğduğu yer olan İslamköy’de Çalça Tepesi’ndeki anıt mezara defnedilecek. İslamköy Muhtarı Hakkı Gökçınar, gerek aile yakınları gerekse Vali Vahdettin Özkan tarafından Çalça Tepesi’nde gerekli çalışmaların yapılması talimatı aldıklarını belirterek, mezar kazımına da başladıklarını açıkladı. Etiketler: Vahdettin Özkan , Süleyman Demirel , Isparta Haberleri « önceki haber sonraki haber »",1
87,"Lice'deki olayları protesto için Hakkari'nin Yüksekova İlçesi'nde iki gündür eylemler sürerken, esnaf da kepenk kapamıştı. Bu sabah yine kepenklerin kapalı olduğu Yüksekova'da, BDP'liler sokak sokak dolaşarak esnafın kepenklerini açmasını istedi. Parti aracından yapılan anons sonrası iş yerlerinin önünde <bekleyen> esnaf yeniden kepenklerini açtı.",0
64,Her <aybaşı> holding gibi zarf  dağılıyor.,0
689,"Vakıftan yapılan açıklamada, Işın Karaca, Kubat ve Sibel Tüzün'ün bu konser için tenor Hakan Aysev tarafından özel olarak hazırlanan opera repertuvarlarındaki aryaları seslendireceği bildirildi. Açıklamada, konserin 15 Aralık akşamı Metrocity'de gerçekleştirileceği, vatandaşların konser biletleri için Türkiye Korunmaya <Muhtaç> Çocuklar Vakfına ait 212 274 95 45 numaralı telefondan bilgi alabilecekleri belirtildi.",0
542,"Kütahya'nın Emet ilçesinde, iki aile arasında çıkan silahlı kavgada 4 kişi hayatını <kaybetti>. Alınan bilgiye göre, ilçeye bağlı Gürpınar köyünde, aralarındaki husumet nedeniyle iki aile arasında çıkan tartışma bir süre sonra kavgaya dönüştü. Silahların da kullanıldığı kavgada 1'i kadın 4 kişinin öldüğü öğrenildi. Olayın ardından bölgeye çok sayıda jandarma ekibi ve ambulans sevk edildi.",1
65,"""<Aybaşı>, pazara denk geldi.""",0
549,"Boğaziçi Üniversitesi Kandilli Rasathanesi Ve Deprem Araştırma Enstitüsü internet sitesinde yer alan bilgiye göre, Elazığ'ın Palu ilçesinde saat 19:30 sıralarında 3.7 büyüklüğünde bir deprem meydana geldi. Yerin 5 kilometre altında meydana gelen sarsıntı çevre illerden de hissedildi. Herhangi bir can <kaybının> yaşanmadığı öğrenilen deprem paniğe sebep oldu.",1
687,"""... Eskiden ayıp sayılan ve orta yerde konuşulmayan meseleleri , örneğin kadın bağı kullanan kadının <muayyen günlerinde> kendini ne kadar kupkuru  ve rahat hissettiğini öğrendik.""",1
169,"T24 -  Tayvan Deniz Kuvvetleri'nde görev alan askerler, hem kara hem deniz eğitiminden geçiriliyor. Tayvan'ın güneyindeki Zuoying bölgesinde verilen 9 haftalık bu zorlu eğitimin son aşamasının adı ise ""<Cennete giden> yol""... Askerler ""Cennete giden yol"" eğitiminde sivriltilmiş mercan kayalarında sürünme, takla atma gibi birçok zorlu engelden geçiriliyor. İşte zorlu eğitimden kareler... CENNETE GİDEN YOL / FOTO GALERİ",0
869,"Türk - İş, 2015 yılı Aralık ayı açlık ve <yoksulluk> sınırı verilerini açıkladı. Buna göre çalışanların geçim koşullarını, fiyat artışları karşısında satın alma gücündeki değişimi ortaya koyan verilere göre; 4 kişilik ailenin açlık sınırı 1.385 lira, yoksulluk sınırı 4 bin 512 lira olarak hesaplandı. Bir kişinin Aralık ayı itibarıyla geçim maliyetinin de 1.683 lira olduğu kaydedildi. Konfederasyona göre 2015 yılında gıda enflasyonu yıllık yüzde 14,29 oldu.",1
771,"Şükrü Saracoğlu'nda olayların yaşandığı derbi maçın ardından Drogba ve Eboue'ye gösterilen muz iddialarının ardından olayın kahramanlarından bir taraftar şu açıklamalarda bulundu. ""Bir operasyon geçirdim. O yüzden genelde meyveyle besleniyorum. Tam meyveyi yerken tezahüratlar başladı elimde meyve olduğu için onu salladım. Benim <siyahi> arkadaşım var. Böyle bir şey yapmam mümkün değil"" İŞTE O ÇOK KONUŞULAN AÇIKLAMA",1
380,"""Yaşamını Hamdım, piştim, yandım sözleri ile özetleyen Mevlâna 17  Aralık 1273 pazar günü <Hakk'ın rahmetine kavuştu>.""",1
163,"Oyuncu Hande Soral, bir süredir <birlikte olduğu> İsmail Demirci ile nişanlandı. Aile bireylerinin katıldığı nişan töreninin fotoğrafları sosyal medyaya düştü. Ünlü kardeşlerden Bensu Soral, ablası ile çekildiği fotoğrafları Instagram hikâyeden paylaştı. İçerde dizisiyle popülerleşen kardeş Soral, mini siyah bir elbise giyerken, Hande Soral tercih ettiği beyaz elbiseyle son derece sadeydi.",0
581,"İstanbul 9. Ağır Ceza Mahkemesi'ndeki dava için tutuklu bulunduğu Edirne F Tipi Cezaevinden adliyeye getirilen Nuri Ergin, cezaevi aracından indirilerek adliye nezarethanesine alınırken ""Veli Küçük'e söyleyin yürekleri varsa bize kendileri mesaj versin. Veli Küçük, akıllı ol. Ben <kaybedecek> maça oynamam"" diye bağırdı.",0
504,"Shakespeare’in hem doğum hem ölüm yıldönümü olarak kabul edilen Dünya Kitap Günü’nde, İngiltere ’de 1 milyon kitap okurlara bedava dağıtıldı. Bu kitapların önemli bir kısmı <ihtiyaç sahiplerine> ulaştırılırken, gecede yirmi yazar hem kendi hem de Shakespeare’in eserlerinden bölümler okudu. Etkinlikte konuşma yapan Elif Şafak, ""Bizde de benzer etkinlikler düzenlenmeye başlandı ama henüz emekleme devresinde. Kitap kampanyalarının artmasını yürekten arzu ediyorum"" dedi.",0
152,"Uzun zamandır <birlikte olduğu> kız arkadaşıyla aile arasında düzenlenen bir törenle nişanlanan Serkan Seki, fotoğraflarını: ""Artık nişanlı bir çiftiz. Şu yüzük takma işine de alıştım mı tamamdır."" notuyla kişisel sosyal medya hesabından paylaştı.",0
840,"Bundesliga ekiplerinden Borussia Dortmund'un orta saha oyuncusu İlkay Gündoğan'ın, babaannesi <vefat etti>. Dursunbey ilçesinde oturan Gündoğan'ın babaannesi Ayşe Gündoğan'ın cenazesi, Çarşı Camisi'nde kılınan namazın ardından ilçe mezarlığında toprağa verildi. İlkay Gündoğan'ın Almanya'dan kiraladığı özel uçakla Balıkesir Kocaseyit Havaalanı'na indiği ancak cenaze törenine yetişemediği öğrenildi.",1
624,"Merkez Mahallesi'ndeki deprem konutlarında oturan Tahir Ç. (33), eşi Ayşe Ç'nin evde olmadığı sırada 3 yaşındaki oğlu Muhammed ve 5 aylık ikizleri Sultan ile İbrahim'i bıçakladı. Çocuklar, olay yerinde yaşamlarını yitirdi. Sesleri duyan çevre sakinlerinin durumu bildirmesi üzerine eve gelen polis ekibi, <madde> bağımlısı olduğu bildirilen Tahir Ç'yi gözaltına aldı. Olayla ilgili soruşturma sürdürülüyor.",1
552,"Mamak Doğukent Caddesi'nde yapımı devam eden bir alışveriş merkezinin inşaatında meydana gelen kazada, işçi Yakup Işık (33) ağır yaralandı. Ankara Eğitim ve Araştırma Hastanesine kaldırılan Işık, burada yaşamını <kaybetti>. Kazanın, yükleme yapan vinçteki malzemenin Yakup Işık'ın üzerine düşmesi sonucu meydana geldiği bildirildi. Olayla ilgili Ankara Cumhuriyet Savcılığı soruşturma başlattı. Vinç operatörü Şaban D. gözaltına alındı.",1
545,"Juan Gabriel, California’daki Los Angeles Forum’da 17 bin kişiye konser verdikten 3 gün sonra hayatını <kaybetti>. Gerçek adı 'Alberto Aguilera Valadez' olan ve kariyeri boyunca 100 milyondan fazla albüm satışına ulaşan Gabriel’in adı, Hollywood Ünlüler Bulvarı’nda da yer alıyor. Meksika Devlet Başkanı Pena Nieto, twitter üzerinden yayımladığı mesajda, ""Gabriel, Meksika'yı temsil eden bir ses ve yetenekti. Müziği dünyaya mirasıydı. Bizi çok erken terk etti"" ifadelerini kullandı.",1
667,"Bakırköy'de bir alışveriş merkezinin otoparkına giren otomobilin bağajında güvenlik görevlileri tarafından rutin kontrol yapılırken, görülen bir cismin, patlayıcı <madde> olabileceği şüphesi üzerine, polise haber verildi. Otoparktan çıkış yapan otomobil polis tarafından kovalamaca sonucu İstanbul Caddesi üzerinde durdurulurken, sürücü ifadesi alınmak üzere gözaltına alındı. Polis caddede geniş güvenlik önlemi alırken, olay yerine gelen bomba imha uzmanları otomobilde arama yapıyor.",0
265,"İstanbul Büyükşehir Belediyesi'nin hazırladığı 2015 - 2019 yıllarını kapsayan stratejik planda İstanbul'da köklü dönüşümler hedefleniyor. Tüm otobüs, minibüs ve taksiler <engelli> kullanımına uygun hale getirilirken minibüslere de İstanbulkartla binilecek. 2019’a kadar minibüs, taksi ve servis araçlarının internet üzerinden ruhsat alması için altyapının tamamlanması planlanıyor. 6 bin 363 minibüs, 393 deniz motoru, 572 taksi engelli kullanımına uygun hale getirilecek.",1
660,"Terörle mücadele savcısı, Cezayir asıllı Merah'ın, annesi, erkek kardeşi ve sevgilisinin gözaltı süresinin uzatıldığını bildirdi. Fransız televizyonu, Merah'ın erkek kardeşinin arabasının bagajında silah ve patlayıcı <madde> gele geçirildiğini duyurmuştu. Merah, üç ayrı saldırı toplam yedi kişiyi öldürmüştü.",0
766,"Uluslararası haber ajanslarına konuşan ABD ’li yetkililer, 63 yaşındaki Holder’ın istifa kararını önümüzdeki saatlerde Beyaz Saray’daki bir etkinlikte resmen açıklayacağını belirtti. Reuters haber ajansı, Holder’ın istifa kararının, ABD’nin Ferguson kentindeki olaylar başta olmak üzere, Adalet Bakanlığı’nı yıpratan bir dizi gelişmenin ardından gelmesine dikkat çekti. ABD’nin ilk <siyahi> adalet bakanı olan Holder, Şubat 2009’dan bu yana görevdeydi. REUTERS",1
737,"Rihanna'nın Dior markası ile çalışmasının moda dünyası açısından farklı bir önemi var. Fransız moda devi Dior, 69 yıllık tarihinde Rihanna ile çalışarak ilk kez <siyahi> bir yüzü reklam kampanyasına taşıdı. Rihanna, Versailles Sarayı'nda gerçekleştirilen çekimde Steven Klein'ın kamerasına verdiği pozlarla şimdiden en çok konuşulan kampanyalardan birine de imza atmış oldu.",1
325,"Karşılaşmanın 42.dakikasında Emre Öztürk ile girdiği hava topu mücadelesinde yere ters basan Salih Dursun, acı içinde yerde kaldı. Salih Dursun'un kaburgasını tuttuğu görülürkeni yıldız futbolcu maça devam edemedi. Ciddi bir sakatlık geçiren Salih'e ambulansla hastaneye kaldırıldı. Salih'in sağlık ekibine nefes almakta güçlük çektiğini belirttiği ve ilk müdahalenin ambulansta yapıldığı açıklandı. Oyuncunun <göğüs> travması geçirdiği öğrenildi.",0
577,"AKP Genel Başkan Yardımcısı Numan Kurtulmuş, sını <kaybına> bağlı hipotansiyon nedeniyle hastanede kontrolden geçti. Durumu Twitter üzerinden takipçileriyle paylaşan Kurtulmuş, ""Sıvı kaybına bağlı hipotansiyon nedeniyle bir kontrol için hastaneye geldim.Gelmişken bir de check - up yaptırmak istedim. Sağlık durumum gayet iyi"" ifadelerini kullandı.",0
467,"ABD'li ünlü televizyon yapımcısı Aaron Spelling 83 yaşında <hayata gözlerini yumdu>. 18 Haziran'da inme geçiren ünlü film yapımcısı, önceki gün Los Angeles kentindeki evinde öldü. Kısa bir süre sinema oyunculuğu da yapan Spelling, pek çoğu Türkiye'de de gösterilen Charlie'nin Melekleri, Hanedan, Aşk Gemisi, Hayal Adası, Evimiz Hollywood'da gibi birçok televizyon dizisinin yapımcılığını üstlenmişti.0",1
843,"Bir süredir tansiyona bağlı sağlık sorunları nedeniyle yoğun bakımda tedavi gören Tamer Karadağlı'nın babası Turgay Karadağlı dün <vefat etti>. Karadağlı için bugün öğle namazını mutakebin kılanan cenaze namazına Tamer Karadağlı'nın yanısıra aile fertleri katıldı. Kılanan cenaze namazın ardından Karadağlı, Gölbaşı Mezarlığı'nda toprağa verildi.",1
250,"Hilvan'da yaşayan zihinsel <engelli> 15 yaşındaki M.H.'nin tecavüze uğradığını belirten yakınlarının şikayeti üzerine güvenlik güçlerince soruşturma başlatıldı. Yürütülen soruşturmada engelli kıza tecavüz ettiği iddiasıyla Cahit S., Orhan H. ve Vedat S. gözaltına alındı. Şüpheliler, ifadeleri alındıktan sonra çıkarıldıkları nöbetçi mahkemece tutuklanırken, sanıkların davasının ise güvenlik nedeniyle Hilvan yerine Siverek ilçesinde görüleceği bildirildi.",1
546,"Yetkililer şu ana kadar herhangi bir yaralanma ya da hasar raporu veya tsunami uyarısı olmadığını söyledi. 6,4 büyüklüğündeki deprem Sumatra adasının 50 kilometre uzağında ve yerden 38 kilometre derinlikte meydana geldi. 2004 yılının Aralık ayında Sumatra adası açıklarında meydana gelen 9.1 büyüklüğündeki depremin ardından tsunami olmuştu ve afette 230 bin kişi hayatını <kaybetmişti>.",1
741,"Jean Ping, Afrika Birliği'nin Libya Ulusal Geçiş Konseyi'ni ülkenin meşru temsilcisi olarak tanımamasının nedenlerinden birinin de bu olduğunu bildirdi. Ping, konunun açıklığa kavuşturulması gerektiğini, çünkü muhaliflerin <siyahi> insanları paralı askerlerle karıştırıp sıradan işçileri de öldürdüklerini belirtti. Libyalı muhalifler, bir hafta süren çatışmaların ardından ülkenin başkenti Trablus'un büyük bir kısmını ele geçirmişti. Ping, her iki tarafa da ölümleri durdurma çağrısı yaptı.",1
446,"IHA Türkiye Spor Yazarları Derneği (TSYD) eski başkanlarından Onur Belge hayatını kaybetti. TSYD eski başkanlarından, gazeteci ve spor yazarı Belge’nin ani bir kalp krizi sonucu <hayata gözlerini yumduğu> öğrenildi. Onur Belge’nin cenazesi yarın Kınalıada Camisi’nde ikindi vakti kılınacak cenaze namazının ardından toprağa verilecek. Etiketler: spor , Onur Belge , İstanbul Haberleri « önceki haber sonraki haber »",1
290,"Güney Afrika Çevre Bakanı Buyelwa Sonjica, Danimarka'nın başkentinde geçen Cuma günü sona eren konferanstan dönüşünde yaptığı açıklamada, ""ev sahibinin görüşmeleri idare şeklinin"" de başarısız sonuçta etkisi olduğunu söyledi. İklim görüşmeleri, gelişmiş ve <gelişmekte olan ülke>ler arasındaki derin görüş ayrılıklarının giderilememesi üzerine, başlangıçtaki hedeflerin çok gerisine düşen bağlayıcılığı bulunmayan zayıf bir anlaşmayla sona ermişti.",0
813,"Başarılı geçen ameliyat sonrası Sayan, bir gün hastanede kaldıktan sonra taburcu edildi. Ameliyata girmeden odasında <uyutulmak> istediğini söyleyen Sayan, videosunu Instagram’dan paylaşıp ""Benim bir şeyim yok derken aniden tüm dünya dönmeye başladı. Şimdi izleyince epey bir güldüm. Çok şükür ameliyat çok iyi geçti"" diye not düştü. (Gazetevatan)",0
882,"Çin Vatandaşlık İşleri Bakanı Li Liguo, merkezi hükümetin felaketlerden etkilenen 75 milyon kişiye 8,64 milyar yüen (yaklaşık 2,4 milyar TL) tahsis ettiğini kaydetti. Çin'de bu yıl meydana gelen doğal felaketlerde ise toplam 440 milyon kişinin etkilendiği ve doğrudan ekonomik kaybın 311 milyar yüen olduğu açıklandı. Ayrıca ilgili bakanlığın <yoksullukla> mücadele eden 81 milyon insanın temel yaşam kalitesinin sağlanması için 146 milyar yüenlik fon aktardığı belirtildi.",1
246,"Belediye başkan adayları tanıtım programı çerçevesinde Van'daki AKP İl Teşkilatının önünde konuşma yapan Milli Eğitim Bakanı Hüseyin Çelik' e bir esnaf işlerinin kötüye gittiği gerekçesiyle ayakkabı fırlatmak istedi. Partililerin müdahale etmesi üzerine protesto girişimi sonuçsuz kalan kişi gözaltına alındı. Emniyet Müdürlüğü'nde sorgulanan kişinin ayakkabı tamirciliği yapan Çetin İşik olduğu, <ekonomik> krizden dolayı işlerinin kötüye gitmesi nedeniyle böyle bir protestoda bulunduğu öğrenildi.",0
736,"""Gizli fuhuşun özellikle İstanbul'da yoğun şekilde sürdüğüne ve yabancı  uyrukluların oranının da gittikçe arttığına dikkati çeken Çokar, İstanbul'da kayıtlı <seks  işçisi> 126 iken, gizli fuhuş yapanların sayısının 30 bin olduğunu söyledi .""",1
441,"Tam adı Abraham Charles Abe Vigoda olan Brooklyn doğumlu ünlü aktör, 94 yaşında <hayata gözlerini yumdu>. Vigoda, Francis Ford Coppola'nın başyapıtı 'Baba' filmindeki Sal Tessio karakterine can vermişti. ABD'li aktör 1970'lere damga vuran Barney Miller dizisinde başrolde rol almıştı. Etiketler: ABD , Ford",1
245,"""Uzun Yürüyüş - 2D"" taşıyıcı roketiyle yörüngeye yollanan uydunun, başta bilimsel araştırmalar olmak üzere, toprak kaynaklarının tespiti ve haritalandırma gibi alanlarda bilgi sağlama amaçlı kullanılacağı ifade edildi. Uydudan sağlanması planlanan verilerin, Çin'in bilim araştırmaları ve <ekonomik> yapılanması adına etkin rol oynayacağı belirtildi.",0
671,"Trabzonspor'da 25 - 26 Mayıs'ta yapılan olağanüstügenel kurulda, 68. <madde>ye ek olarak konulan yönetimin görev süresini 6 aydan 30 aya çıkartan ek 4. madde kabul edilmedi. Mahkeme seçimi iptal edip yeniden yapılmasına karar verdi. Bordo - Mavili camiada genel kurul 24 - 25 Aralık'ta bir kez daha toplanacak.",0
550,"Kadıköy'deki Florence Nightingale Hastanesi'nde 30 Mart Cuma gününden beri tedavi gören ve dün akciğer ödemi nedeniyle hayatını <kaybeden> Ekrem Bora için, yarın saat 10.30'da Akatlar Kültür Merkezi'nde tören düzenlenecek. Bora'nın cenazesi, törenin ardından öğle vakti Zincirlikuyu Camisi'nde kılınacak cenaze namazının ardından Zincirlikuyu Mezarlığı'nda defnedilecek.",1
610,"Halk Plajı'nda serinlemek amacıyla denize giren Halis Balıkçı (73), bir süre sonra çırpınmaya başladı. Suda <kaybolan> yaşlı adam, Karasu Belediyesi cankurtaran ekiplerince kıyıya çıkarıldı. Sağlık ekiplerinin ilk müdahalesinin ardından Karasu Devlet Hastanesi'ne kaldırılan Balıkçı, buradaki müdahalelere rağmen hayatını kaybetti. 4 çocuk babası olduğu öğrenilen Balıkçı'nın cesedi otopsi için İstanbul Adli Tıp Kurumu'na gönderildi.",0
289,Binlerce  insan çalışıyor Tarım ekonomisinde olan biteni çok iyi izleyen Ali Ekber Yıldırım’dan  aldığım bilgilere göre fındıkları iqşlemek için de 1 milyon 250 bin ton  kapasiteli (dikkat buyurunuz yıllık üretim 650 bin ton) 170’in üzenide  <fındık kırma> fbarikası ve 300 bin ton iç fındık işleme kapasitesine sahip  20’nin üzerinde fındık işleme tesisi var.,0
100,"Meteoroloji 2. Bölge Müdürlüğü yetkililerinin açıklamasına göre; 3 - 4 gün boyunca hava daha da ısınacak ve ""ekstrem"" sıcaklığa ulaşacak. 19 Nisan Salı günü termometreler 32 dereceyi gösterecek. İzmir'de nisan ayında kaydedilen en yüksek derece olan 32.5'e yaklaşması <beklenen> hava sıcaklığı, 20 Nisan'dan itibaren kuzey rüzgarları nedeniyle düşüşe geçecek. Hava sıcaklığı, gelecek 4 gün boyunca Aydın, Manisa, Çanakkale ve Balıkesir'de de mevsim normallerin üstünde olacak.",0
39,"""Bu  yüzdendir ki, ilimsiz kerâmet açığa çıkarmak bütün evliyaullah nazarında <aybaşı> gören  kadının kanı; olarak nitelendirilmiştir!""",1
19,"""Kadınların <aybaşı> dönemlerini düzenler, adet sancılarını geçirir, vajinal bir  çok hastalığı iyileştirir ve menopoz dönemini kolaylaştırır.""",1
892,"Geçmişte <yoksullukla> mücadele ve insan hakları için küresel kampanyalar yürüten Kumi Naidoo, bugün çevreci örgütün yeni icra müdürü olarak görevine başladı. Naidoo, yerkürenin tümü tehdit altında olduğu sürece diğer kalkınma meseleleriyle uğraşmanın anlam ifade etmediğine dikkati çekti. Naidoo'nun yerine geçtiği Gerd Leipold, Naido'nun örgüte başkanlık edecek ilk Afrikalı ve örgüt dışından gelen ilk kişi olduğunu söyledi.",1
218,"IMF ile işbirliği askıya alınan ve Rusya ile AB arasında kalan Ukrayna, içinde bulunduğu <ekonomik> darboğazdan çıkabilecek mi? Türk Ukrayna İşadamları Derneği (TUİD) Başkan Vekili Burak Pehlivan'ın konuyla ilgili değerlendirmeleri, Avrasya Haber Portalı'nda: http: /  / www.avrasya - haber.net / ukrayna / ukrayna - da - yeni - hukumet - ve - 2013 - de - ulkeyi - bekleyen - zorluklar",0
400,"""Safevi devleti Alevi inancının  resmi olarak tanındığı, gelişmesinin desteklendiği, hatta örgütlendirildiği bir devlettir,  önemi de buradadır Şah İsmail’in <Hakka yürümesinden> (1504) sonra yerine  oğlu 1.Tahmasp geçti.""",1
851,"Fox Ana Haber’in sunucusu Fatih Portakal'ın babası <vefat etti>. Bir süredir babasının sağlık durumunun kötü olduğu bilinen Fatih Portakal acı haberi bugün aldı. Fatih Portakal’ın babasının vefat ettiğini mesai arkadaşı İsmail Küçükkaya Twitter’dan duyurdu. Küçükkaya twitter’dan attığı mesajda ""Kardeşim Fatih Portakal babasını kaybetti; Allah rahmet eylesin. Başın sağolsun kardeşim. Sabır diliyorum."" ifadeleri ile kötü haberi kamuoyu ile paylaştı.",1
755,"Naomi Campbell, Vogue dergisinin Brezilya edisyonunun 41’inci yıl dönümü baskısı için kamera karşısına geçti. 45 yaşındaki süper model, fotoğrafçı Zee Nunes’un objektifine 1970’ler ruhunu yansıtan iddialı pozlar verdi. 1989’da derginin Amerikan edisyonuna kapak olan ilk <siyahi> model unvanlı Campbell, o dönemler dergiye kendisini öneren Anna Wintour hakkında ""Bunun için çok fazla çabaladığını bilmiyordum. Anna, bana çok büyük bir fırsat verdi"" dedi.",1
300,"Erkekli kampanya için çektiği videoda, tiyatrocu olmasını sağlayan İngilizce öğretmeni Pesen Şentürker’in sözlerini şöyle aktardı: ""Bırak bu inşaat mühendisliği sevdasını. Bizim gibi <gelişmekte olan ülke>lerde insan inşasına gerek var. İnsan inşasının ihtiyacı da sanatla oluyor. Söz ver, bana eğer bir şey olacak olursa yine de tiyatrocu olacaksın değil mi?""",0
47,"""Yukarıdaki süreler,  ihya edilen süreye ilişkin tutar dahil her türlü borçların ödendiği tarihi takip  eden <aybaşı> itibarıyla bu Kanuna göre aylık bağlanmasında dikkate alınır.""",0
