num,text,label
296,"İZMİR Milliyet Menemen Belediye Başkanı Tahir Şahin, ""<Gelişmekte olan ülke>lere ve bireylere yardım etmek bizim özelliğimiz olduğu için teklifi hiç düşünmeden kabul ettik. Bu eğitimin başka bir önemi de toprak sanatında ilçemizin ne kadar ileri bir düzeyde olduğunun göstergesidir. Bizim için en büyük onur, burada öğrendiklerini kendi ülkelerinde uygulamaları ve başkalarına da öğretmeleri olacak"" dedi. Etiketler: haber , haberler ,",1
109,"Bir Ukrayna gazetesine konuşan Korsunski, Türkiye'nin Ukrayna'ya Saroz Körfezi'ne inşa edilecek LNG terminalini alternatif olarak gösterdiğini, fakat bu konuda somut bir teklifte bulunmadığını ifade ederek, ""kaderimizi başkalarının insafına terk edemeyiz"", diye konuştu. Haberin devamı, Avrasya Haber Portalı'nda: http: /  / www.avrasya - haber.net /  ukrayna / ukrayna - turkiyeden -  somut - oneri - <bekliyoruz>",0
303,"Scott Moore ve evli olduğu Thomas, aslında kız olarak dünyaya geldiler. Scott, <göğüslerini> aldırdı ama cinsiyet değiştirme ameliyatı olmadı. Thomas ise cinsiyet değiştirme operasyonuyla erkek oldu. Terapi grubunda buluşan ikili, 2007 yılından beri birlikte. Scott, 2009’da bir erkek arkadaşından alınan spermle hamile kaldı. Bebek, Şubat ayında doğacak. Dünyanın ilk hamile erkeği Thomas Beatie, 14 Temmuz 2008’de kızı Susan Juliette Beatie’yi dünyaya getirmişti.",1
73,"Güzel oyuncu Drew Barrymore, ikinci kez anne olmaya hazırlanıyor. Oyuncunun sözcüsü Chris Miller, 38 yaşındaki Barrymore ve eşi Will Kopelman'ın ikinci çocuklarını <beklediklerini> belirtti. Barrymore ve Kopelman'ın 13 aylık Olive adında bir kızları var. Çift, 2012 yılı Haziran ayında evlenmişti. Chanel'in eski üst yöneticisi Arie Kopelman'ın oğlu olan Will Kopelman, sanat danışmanlığı yapıyor.",1
10,"Müdavimleri arasında gazeteci, edebiyatçı, oyuncu ve her türden sanatçının yer aldığı efsane meyhane yaza büyük bir atılım yaparak giriyor. Üç yıl önce <aramızdan ayrılan> Yakup Arslan’dan görevi devralan Yıldıray ve Ufuk Arslan’ın, Mystaff İnsan Kaynakları işbirliğiyle hayata geçirdiği Yakup 2 Bosphorus, klasikleşmiş lezzetlerini yenilenen mutfaklarıyla bir üst seviyeye taşıyarak misafirlerine hizmet vermeyi amaçlıyor. Etiketler: Beyoğlu , İstanbul",1
194,"DIŞ HABERLER SERVİSİ İnternette zoofili (hayvanlarla <cinsel ilişkiye girme>) ile ilgili bir sohbet odasında tanıştığı adamın evine gittikten sonra köpeğiyle ilişkiye giren kadın, sperme alerjisi olduğu için kısa süre sonra fenalaşarak, öldü. İrlanda’da 1861’de çıkan normalin dışındaki cinsel davranışlarla ilgili yasaya göre, köpeğin sahibi Sean McDonnell yargılanacak. Etiketler:",1
153,"Mustafa Denizli, 1977'de evlendiği, kızı Selin'in annesi Jülyet Aruh'tan 1989'da boşanmıştı. 14 yıl Çiğdem Kayalı ile <birlikte oldu>. Kızları Lal dünyaya geldi. Posta Gazetesi'nin haberine göre; 67 yaşındaki futbol adamı, Temmuz 2010'da kendinden 25 yaş küçük Evin Elçi ile evlendi. Mustafa - Evin Denizli çiftinin boşanacağı belirtildi.",0
426,"Samsundan bir hafta önce RoRo gemisiyle Rusyaya giden TIR şoförü Erdal Sarı (27), Novorossissk Limanında Rus <hayat kadını> için çıkan tartışmada bir Türk şoför tarafından bıçaklanarak öldürüldü. İddialara göre, hayat kadını için tartışan arkadaşlarını ayırmak isteyen Sarıyı, Ali Yıldırım (48) adlı bir şoför bıçakladı. Sarı olay yerinde ölürken, Yıldırım kayıplara karıştı.0",1
604,"Rusya Parlamentosu Alt Meclisi Duma'da kabul edilen yasaya göre, Rus internet sitelerinde alkol reklamı yayınlanması yasaklanacak. Basın ve reklam şirketleri arasındaki anlaşmalar yıllık yapıldığı için, yasanın 1 Ocak 2013 tarihinde yürürlüğe girmesi planlanıyor. Yasaya karşı çıkan gruplar, alkol reklamlarının yabancı internet sitelerine kayacağını ve gelir <kaybına> yol açacağını savunuyor.",0
375,Bunları en iyi Sayın Ergün Göze ağabeyimizin bilmesi lazım;  zira Peyami Safa <Hakk'ın rahmetine kavuştuğunda> avukatı idi.,1
199,"""Önde iki tane uzun kolu var, arkada iki tane kısa  kolu var beni götüren <dört kollu>nun… Üstelik kimsenin omzuna yük de olmuyor ; kendi gidiyor!""",1
395,"Berk Oktay, Twitter hesabı üzerinden şu açıklamayı yaptı: ""Büyükbabam <hakkın rahmetine kavuşmuştur>. Ankara'da  yapılan Askeri törenle ikindi namazının ardından Karşıyaka'da  toprağa verilen dedesinin cenazesinde sevenleri ve dostları yalnız bırakmadı. Ünlü oyuncu Twitter'dan herkese teşekkür etti.",1
833,"Devrimci Sosyalist İşçi Partisi Genel Başkanı (DSİP) Doğan Tarkan kalp krizi nedeniye 65 yaşında <vefat etti>. Tarkan, 12 Eylül 1980 Darbesi sonrası yurtdışına kaçmış, Sosyalist İşçi gazetesini yurtdışında çıkarmış ve bu gazete çevresi ile birlikte DSİP'i kurmuştu. Türkiye'ye döndükten sonra 1997 yılından itibaren de parti genel başkanlığı yapmaktaydı. Sosyalist İşçi ve Altüst dergilerinde güncel yazılar yazıyordu.",1
841,"Uzun süredir alzheimer tedavisi gören ünlü bestekar ve sanatçı Selahattin Erköse, 84 yaşında <vefat etti>. 50 kadar beste ve saz eseri bulunan Erköse'nin cenazesi, Şişli Camii'de yarın öğle namazını müteakip kılınacak cenaze namazının ardından toprağa verilecek.",1
278,"3 yıllık doping cezası sonrası pistlerden uzak kalan Nevin Yanıt, 6 Mart’ta başlayacak Dünya Salon Atletizm Şampiyonası’nda yeniden yarış heyecanı yaşayacak. Milli atlet, Amerika Birleşik Devletleri’nin ev sahipliği yaptığı organizasyonda, 60 metre <engelli> yarışında 8.14’ün altında koşarsa, dünya barajını geçecek. Yanıt, bu durumda memleketi Mersin’de Rio Olimpiyat kotası için piste çıkma hakkı kazanacak. (Trtspor)",0
157,"""People"" dergisine açıklama yapan çift, harika geçen evlilik törenlerinde aileleri ve arkadaşlarıyla bir arada bulunmanın özel olduğunu belirtti. Birkaç yıldır <birlikte olan> çiftin, İtalya'nın güneyinde dünya evine girdikleri belirtildi. 31 yaşındaki Justin Timberlake ve 30 yaşındaki Jessica Biel, geçen aralık ayında nişanlanmıştı. (CNN Türk)",0
454,"IHA Haberin diğer fotoğrafları için tıklayın Türkiye Cumhuriyeti’nin kurucusu Mustafa Kemal Atatürk, ebediyete intikalinin 77. yılında tüm yurtta olduğu gibi Sungurlu’da da anıldı. Atatürk’ün <hayata gözlerini yumduğu> saat 09:05’de sirenlerin çalmasıyla birlikte vatandaşlar, 1 dakikalık saygı duruşunda bulundu. Bazı vatandaşlar araçlarından inerek saygı duruşunda bulundu. Etiketler: Atatürk , Mustafa Kemal Atatürk , Çorum Haberleri « önceki haber sonraki haber »",1
551,"Su bayramının ilk beş gününde meydana gelen toplam 2724 trafik kazasında 2891 kişi yaralanırken, 338 kişi de hayatını <kaybetti>. Yayınlanan trafik kazaları raporuna göre geçen yıla oranla kaza sayısı yüzde 13,2 artarken, yaralanma sayısı yüzde 14,2 ve ölü sayısı da yüzde 34,7 oranında arttı.",1
824,"DIŞ HABERLER Kanında kuduz virüsüne rastlanan Reynolds için doktorlar, aşı için geç kalındığını ve durumun umutsuz olduğunu söyledi. İlkokul öğrencisi küçük kız koma ünitesine alınarak <uyutuldu> ve virüsün ilerlemesini kesici ilaç tedavisi uygulandı. 2 hafta yoğun bakımda kalan Precious’un bağışıklık sistemi tedaviye cevap vererek virüsü yenmeyi başardı. Etiketler: ABD",0
758,"<Siyahi> şarkıcılar Jay - Z ve Kanye West’in konser için Paris’te bulundukları sırada Paltrow, Twitter hesabına ""Zenciler Paris’te gerçekten"" yazdı. Ünlü oyuncu ikilinin ünlü ""Zenciler Paris’te"" şarkısına gönderme yapmış olsa da bu tweet siyahilerin tepkisini çekti. Paltrow ırkçılıkla itham edildi. Etiketler:",1
270,"Ankara Barosu Kültür Merkezi'ndeki sergisinin açılışında konuşan Ankara Barosu Başkanı Vedat Ahsen Coşar, sergiye sadece yer tahsis ettiklerini asıl emek sahibinin zihinsel <engelli> çocuklar olduğunu söyledi. Konuşmanın ardından serginin açılışını Coşar, ZİÇEV Genel Başkanı Ülay Karakoç ve bir zihinsel engelli yakını birlikte yaptı. Anıtkabir, Ankara Garı, Atatürk Evi gibi Ulu Önder Atatürk'e ilişkin 53 mekanın fotoğrafının yer aldığı sergi, 26 Kasıma kadar açık kalacak.",1
155,"Olay, Buca 921 Sokak'taki evde meydana geldi. Emekli A.İ., bir süredir <birlikte olduğu> Nermin Akçay ile henüz bilinmeyen bir nedenle tartışmaya başladı. Tartışmanın kavgaya dönmesi üzerine A.İ. iddiaya göre, Akçay'ı bıçaklayıp evden ayrıldı. Bugün sabah saatlerinde Karabağlar Polis Merkezi'ne giden A.İ. polise teslim oldu. Gözaltına alınan A.İ.'nin olayı anlatması üzerine eve giden polis, kadının cansız bedenini buldu. Olayla ilgili başlatılan soruşturma sürüyor.",0
457,"IHA Gençlik ve Spor Bakanı Akif Çağatay Kılıç’ın babaannesi Leman Kılıç vefat etti. Leman Kılıç’ın cenazesi, yarın Samsun Büyük Camii’nde ikindi namazına müteakip kılınacak cenaze namazının ardından Badırlı Mahallesi’ndeki aile kabristanlığında toprağa verilecek. Merhume Kılıç, 1961 - 1980 yılları arasında 5 dönem üst üste milletvekilliği yapan ve 2013 yılında <hayata gözlerini yuman> İlyas Kılıç’ın eşiydi. Etiketler: Leman , spor , Samsun , Samsun Haberleri « önceki haber sonraki haber »",1
796,Pandayı bulan veterinerler hastalığı teşhis etmek için hayvana narkoz verme kararı aldı. Ancak klinikteki narkoz makinesi küçük kalınca 5 litrelik bir su şişesi maskeye dönüştürüldü ve dev panda bu sayede <uyutuldu>. Karantinada tutulan pandanın tedavisi devam ediyor. Etiketler: Çin,0
402,YILDIRIM  GÜRSES <HAKKA YÜRÜDÜ> - 18 - KASIM - 2000 Sanat dünyasından bir  yıldız daha kaydı.,1
774,"Radyospor’a konuşan Ateş, ""Webo yazın bizzat beni aradı. <Siyahi> bir oyuncu olduğu için beyaz formanın kendisine çok yakışacağını söyledi. Başkanlar düzeyinde bir görüşme oldu; ama anlaşma sağlanamadı. Belediyespor’un istediği fiyat çok yüksekti. Dengeyi bozmamak prensibi nedeniyle Webo‘dan vazgeçtik"" ifadesini kullandı",1
593,"ABD Jeolojik Araştırmalar Merkezi USGS, depremin Veracruz eyaletindeki Alvarado'nun 45 kilometre kuzeydoğusunda olduğunu aktardı. Yerel yetkililer de, Veracruz'da çok katlı binaların sarsılmasına yol açan depremin ilk bilgilere göre can ve mal <kaybına> neden olmadığını söyledi. Bu arada, Meksika Körfezi'nde petrol ve doğalgaz tesisleri olan devlete ait Pemex firması, güçlü bir sarsıntı hissettiklerini, ancak tesislerinin normal faaliyetine devam ettiğini, herhangi bir sorun olmadığını açıkladı.",0
571,"Sur ilçesine bağlı Balılçılarbaşı semtindeki Dört Ayaklı Minare çevresinde, bir ara sokaktan çıkan iki kişi, devriye görevi yapmakta polis aracına ses bombası atarak kaçtı. Olayda herhangi bir yaralanma veya can <kaybı> yaşanmadı. Olay yerine giden takviye polis ekipleri, kaçan şahısları arama çalışmalarına başladı.",1
319,"Tuba Ünsal, Gökay Gündoğdu'nun  önceki gün gerçekleştirilen defilesine katıldı. Defileye <göğüs> dekolteli elbise ile gelen güzel oyuncu, modanın içinde olmaktan ve takip etmekten mutlu olduğunu söyledi. Evden çıkarken özel bir hazırlık yapmadığını belirten Ünsal, ""Benim için en büyük modacı annem. Anneme bir ip verin ve izleyin, onunla neler yapar. Yeni bana mayo örmüş, resmini attı. Bu yaz tatilde onun giyeceğim"" dedi. (Gecce.com)",1
136,"Medyada sürekli kendisi hakkında olumsuz haberler yapıldığını söyleyen Kanye West, bunun sebebinin, medyanın bir siyahla bir beyazın ilişki yaşamasına tahammül edememesi olduğunu ileri sürerek, Kim Karsahian'la nişanlı olmasına atıf yaptı. ""Beni bir manyak ve bir hayvan gibi gösteriyorlar"" diyen West'e, TMZ'den cevap geldi: ""Seni Kim Kardashian'la <birlikte olmadan> önce de eleştiriyorduk""",0
779,"Trafik kazasında iki ayağını kaybeden ""Uncle Willie"" yi <uyutmak> zorunda kalan Hemingway, 1950 tarihli bir mektubunda bir arkadaşına ""Bir insanı öldürmek zorunda kalabilirdim ama asla sevdiğim ve 11 yıldır tanıdığım bir canlıyı değil"" sözleriyle üzüntüsünü tarif ediyor. Kedisini uyuttuğu gün Küba’daki evini ziyarete gelen turistlerden de mektubunda bahseden yazar ""Onlara kötü bir zamanda geldiklerini söyleyerek anlayış göstermelerini rica ettim"" diyor.",1
256,"Artvin Valiliği’nden yapılan açıklamada, kar ve buzlanma nedeniyle Artvin il merkezi ile Borçka ve Murgul ilçelerindeki tüm okullarda eğitim - öğretime bir gün süreyle ara verildiği belirtildi. Açıklamada, il merkezindeki kamu kurumlarında görev yapan <engelli> ve hamile personelinde 1 gün süreyle idari izinli sayılacağı kaydedildi.",1
855,"Büyükşehir Belediyesinden yapılan açıklamada, Niğde eşrafından merhum Hacere ve Nurettin Soykan'ın  kızı, eski CHP Eskişehir Milletvekili merhum Şevket Asbuzoğlu'nun  eşi, Yılmaz Büyükerşen'in  eşi Seyhan Büyükerşen'in  annesi Behiye Asbuzoğlu'nun  <vefat ettiği> bildirildi. Asbuzoğlu'nun cenazesi yarın Mahmut Sami Ramazanoğlu Camisi'nde kılınacak namazın ardından Esentepe Mezarlığı'na defnedilecek.",1
298,"ABD Merkez Bankası’nın aldığı kararlar, piyasalarda deprem etkisi yaratırken, altın fiyatları da çakıldı. Altının ons fiyatı yüzde 2’den fazla düşerek 1.316 dolarla 2.5 yılın dibine geriledi. <Gelişmekte olan ülke> piyasalarında satışlar devam ederken, dolar içeride de 1.915 TL’yi geçti. Borsa İstanbul’da düşüş yüzde 3,6’ya ulaştı.",1
266,"Fransa savunma bakanlığından yapılan açıklamada eğitim uçağının teknik bir arıza nedeni ile düştüğü belirtildi. Pilot ve yardımcı pilotun paraşütleri sayesinde yara almadan kurtuldukları kazada, uçağın düştüğü binada fiziksel <engelli> bir vatandaşın öldüğü, 3 engellinin de yaralandığı belirtildi.",1
243,Yeni statünün Şampiyonlar Ligi'nin 'kapalı bir lige' çevireceğini sunan federasyonlar 2018 ile 2021 yılları arasında uygulanacağı açıklanan bu yöntemin ülke liglerine olumsuz etki yapacağını savundu. Yeni statüyle birlikte Avrupa'nın büyük kulüpleriyle diğer takımlar arasındaki <ekonomik> farkın daha da artacağını belirten federasyonlar bu uygulamanın Şampiyonlar Ligi'nin sonunu getirebileceğini belirterek gözden geçirilmesini talep etti.,0
523,Daha sonra <ince hastalık>tan ölmüş.,1
789,"Pendik Eğitim ve Araştırma Hastanesi Yöneticisi Prof. Dr. İsmail Cinel, kafa ve göğüs travması geçiren Sadıkoğlu'nun tedbir amaçlı <uyutulduğunu> bildirdi. Prof. Cinel, ""Tedaviye yanıt veriyor. Bu olumlu bir gelişme. Birkaç gün içinde uyandırılacaktır"" dedi. Kahraman Sadıkoğlu'nun önümüzdeki günlerde ameliyat edileceği belirtildi.",0
438,"İHA Erdal Eren’in annesi Şadan Eren, bir süredir tedavi gördüğü Ankara’da <hayata gözlerini yumdu>. 100.000  Sanal Para ve Eğitim Rehberi ile Forex’i Ücretsiz Öğrenin! 2016 Yılı 4.Çeyrek Kâr / Zarar Oranı: %18  /  %82 Etiketler:",1
228,"Jokey Kulübü’nden yapılan açıklamada, Şirinyer Hipodromu’nda koşulması gereken yarışların, eylem nedeniyle gerçekleştirilemediği, İzmir Komiserler Kurulu kararı ile At Yarışları Yönetmeliği’nin 9 / c maddesi gereğince ileri bir tarihe ertelendiği bildirildi. Ancak ertelemenin nedeninin, seyislerin <ekonomik> iyileştirme taleplerinin kabul görmemesi olarak gösterildi. Seyisler, İzmir’deki yarışlar için koşacak atları piste çıkarmama kararı aldı.",0
589,"Çin Ulusal Sel ve Kuraklıkla Mücadele Yönetim Merkezi tarafından yapılan açıklamaya göre, 120 milyon kişinin yaşamını olumsuz etkileyen sellerde 367 kişi de <kayboldu>. Sellerin yol açtığı doğrudan ekonomik zarar da 152 milyar 400 milyon yüene (22,5 milyar ABD doları) ulaştı. Öte yandan, ülkenin kuzeybatısındaki Gansu eyaletinde, su basan kömür ocağında mahsur kalan 13 işçinin öldüğü açıklandı. Pazar günü Ciuçien şehrindeki madeni su basmış, 16 işçiden 3'ü kurtulmayı başarmıştı.",0
411,"""Miferprex  adlı etken maddeyi içeren ve iki aylığa kadar <hamilelikleri sonlandıran> ilaç,  henüz Türkiye’de yok.""",0
355,"Dr. Öz, Las Vegas’ta önceki gün düzenlenen, 38. Geleneksel Daytime (Gündüz Yayınlanan) Emmy Ödül Töreni’nde iki ödül kazandı. En iyi talk şov sunucusu ödülünü Regis Philbin ve Kelly Ripa ile paylaşan Öz, ayrıca "" The Dr. Oz Show"" programıyla ""En İyi Bilgilendirici Talk Şov"" ödülünü de kazandı. Hürriyet'ten alınan habere göre, ödülünü alan Öz, derin <göğüs> dekolteli elbisesiyle dikkat çeken eşi Lisa’yla kırmızı halıda öpüşürerek sevincini paylaştı.",0
74,Prens George'un Yeni Zelanda'da  yarattığı sempatinin etkileri sürerken US Weekly yakın bir zamanda George'un abi olacağını iddia etti. Habere göre Kate Middleton'ın hamile olmadığı ancak ikinci çocuk için plan yapıldığı belirtildi. Kraliyet çiftine yakın kaynaklara dayandırılan haberde çiftin büyük bir aile istediği belirtildi. Prens William 11 Nisan'da Yeni Zelanda'da Kate'in yeni bebek <bekliyor> olabileceğini ima etmişti. Cnn Turk,1
800,Dailo ve eşi 3 aylık bebekleri Seth’i <uyutmak> için ilginç bir yöntem bulmuşlar. Bir kağıt mendil ile uyguladıkları bu yöntem sayesinde minik Seth bir dakikadan kısa bir süre içinde uykuya dalıyor. Peki sizin çocuğunuzu uyutmak için en tuhaf yönteminiz ne?,0
259,"Cumhuriyet Halk Partisi Genel Başkanı Kemal Kılıçdaroğlu, Türk Silahlı Kuvvetleri Rehabilitasyon Merkezinde tedavi görmekte olan Sanatçı İbrahim Tatlıses'i de ziyaret etti. CHP Genel Başkanı Kılıçdaroğlu, 19 Eylül Gaziler Günü öncesinde Rehabilitasyon Merkezinde tedavi olan yaralı ve <engelli> gazilerle oturup bir süre sohbet etmesinin ardından TSK Rehabilitasyon Merkezinde tedavi görmekte olan Sanatçı İbrahim Tatlıses'i de ziyaret ederek geçmiş olsun dileğinde bulundu.",1
768,"<Siyahi> bir erkeğin eşlik ettiği klibi tanıtmak için sabırsızlandığını belirten Emmelie De Forest You Tube’de hayranlarının fikirlerini sordu. Direktörlüğünü Mike Spooner, Prodüktörlüğünü Mads Mardstand’ın yaptığı Drunk Tonigtht (bu gece sarhoş) adlı klipte cesur pozlar veren Emnelie De Forest hayranlarından tam not aldı. Emelie de Forest Face Book sayfasında hayranlarına ""işte resmi video görüntülerim, ne düşünüyorsunuz? sorusunu yöneltti.",1
769,"DIŞ HABERLER İngiltere’de yayımlanan Telegraph gazetesi bazı kesimlerin küpeleri egzotik bulduğunu belirtti. Ancak gazete bazı kesimlerin ise lüks giyim markası DolceGabbana’nın küpelerini takan kadınların <siyahi> kadınları küçümsediğini düşündüğünü yazdı. DG’nin şimdiye dek hiçbir siyahi mankenle çalışmadığını belirtenler beyaz ırkı temsil ettiği öne sürülen bu markanın, siyahi kadın küpeleriyle sömürgeciliğe gönderme yaptığını düşünüyor. Etiketler: haber , haberler ,",1
423,"Yönetmen Erden Kıral ile oyuncu Nurgül Yeşilçay, yeni bir film projesinde bir araya geldi. Kıral, daha önce ""Vicdan""da başrol oynattığı Yeşilçay’la yeni filmi "" Gece "" için de anlaştı. 2008 yapımı ""Vicdan""da bir <hayat kadınını> oynayan Yeşilçay, bu kez bir konsomatrisi canlandıracak. Çekimler temmuz ayında İzmir ’de başlayacak. Usta oyuncu İlyas Salman’ın da rol alacağı ""Gece""de Yeşilçay’ın partnerinin kim olacağı ise henüz belli değil. (Hürriyet)",1
343,"Demet Akalın, <göğsündeki> kist nedeniyle ameliyat olan ünlü modacı Nur Yerlitaş’ı hastanede ziyaret etti. Göğsünde kist tespit edilen ünlü modacı Nur Yerlitaş, ameliyat oldu. Ünlü modacıyı hastanede ziyaret eden Demet Akalın, Nur Yerlitaş’ın fotoğrafını İnstagram hesabından paylaştı. Akalın, fotoğrafın altına şunları yazdı: ""Serdar hocamla, Nurellam kontrolde. O kötü kelimeyi lütfen yazmayın, morali bozuluyor Nurumun. Her şey çok güzel olacak, dostları yanında.""",0
118,"Partinin gençlik kollarında görevli bir yöneticinin, parti binasında bir kadınla <birlikte olduğu> ve bu ana ilişkin görüntülerin ortaya çıktığı iddia edilmişti. Şikayet üzerine olayla ilgili olarak dört kişi gözaltına alındı. Demokrat Gebze gazetesinin haberine göre, olayla ilgili olarak; B.K, S.M. ve H.T. ile D.A emniyette ifade verdi ve adliyeye sevk edildi. Dört kişinin adliyede serbest bırakıldığı bildirildi. AKP BİNASINDA SEKS SKANDALI: PARTİNİN KURUCUSUNDAN YORUM GELDİ",1
575,Antalya'nın Kaş İlçesi açıklarında Akdeniz Doğu Baseni'nde saat 12.38'de Richter ölçeğine göre 3.4 büyüklüğünde deprem meydana geldi. Yerin 8.6 kilometre derinlikteki deprem Kaş'a bağlı Bayındır Mahallesi'ne 38.8 kilometre uzaklıkta meydana geldi. Deprem ilk belirlemelere göre herhangi bir can ve mal <kaybına> neden olmadı.,0
269,"Zihinsel <engelli> olduğu belirtilen Z.G'nin  (23) ablası, polise, kardeşinin tecavüze uğradığı ihbarında bulundu. Soruşturma başlatan ekipler, İlçe Tarım Müdürlüğü'nde teknisyen olarak görev yapan Hacı Y.K'yi genç kıza, resmi araçta tecavüz ettiği iddiasıyla gözaltına aldı. Zanlı, çıkartıldığı mahkemece tutuklanırken, genç kızın 8,5 aylık hamile olduğu belirtildi.",1
459,"RADİKAL -  Sümer Tilmaç'ın ölümü ailesi, hayranları ve dostlarını yasa boğdu. 67 yaşında <hayata gözlerini yuman> sanatçı, Sedat Peker'in Esma Sultan Yalısı'ndaki düğününe katılmıştı. Burada kalp krizi geçiren usta oyuncu, kurtarılamadı. Düğünde objektiflere takılan Tilmaç, son kez böyle görüntülendi.",1
78,"Beşiktaş, Fenerbahçe'yle yollarını ayıran milli sağ bek Gökhan Gönül'ü özel uçakla İzmir'den İstanbul'a getirdi. Siyah - beyazlılar, öğleden sonra Gökhan Gönül'ü İzmir'den özel uçakla İstanbul Sabiha Gökçen Havalimanı'na getirdi. Tecrübeli futbolcu ve Beşiktaşlı yöneticiler, transferle ilgili son detayları görüşmek üzere bir araya gelecekler. Son pürüzleringiderilmesinin ardından tecrübeli futbolcunun kendisini Beşiktaşlı yapan sözleşmeye imza atması <bekleniyor>. (Lig Radyo)",0
143,"2002 yılından bu yana <birlikte olan> ve geçen yıl nişanlanan çiftin nikahını, Ford'un son filminin çekimlerinin sürdüğü New Meksiko eyaletinin valisi kıydı. Ford'un halkla ilişkiler sorumlusu Ina Treciokas, nikahın, eyaletin başkenti Santa Fe'deki valilik binasında önceki gün kıyıldığını belirtti. ""Indiana Jones"" filmlerinin 67 yaşındaki yıldızı Ford üçüncü evliliğini yaparken, 45 yaşındaki Flockhart ilk kez dünya evine girdi.",0
14,"Geride bırakmaya hazırlandığımız 2013 yılı genelinde sanat , spor , siyaset, medya ve bilim dünyasından pek çok ünlü isim <aramızdan ayrıldı>. Arabesk müziğin 'Baba'sı ünlü sanatçı Müslüm Gürses, Usta gazeteci Mehmet Ali Birand ve daha çok sayıda sevilen isim...",1
572,"Şanlıurfa'nın Ceylanpınar ilçesinde iki polis memurunun evlerinde ölü bulunması haberi üzerine lira ve borsa değer <kaybetti>. Sabah açılışta 2.68 lira dolayında hareket eden dolar, haberin ardından 2.71 lirayı da aşarak 2.7125 liraya kadar tırmandı. Aynı haber Borsa İstanbul'da da hisse senetlerine satış getirdi ve Endeks'teki kayıplar yüzde 1.0 düzeyini aştı. Borsa İstanbul Endeksi 81 bin 031 puana kadar geriled",0
902,"İsviçre'nin Davos kentinde düzenlenen 42. Dünya Ekonomik Forumu'na katılan Gates, burada yaptığı açıklamada, ""Bu sıralar zor bir ekonomik dönemden geçiyoruz, ancak bu durum <yoksulların> kalkınmasına yardımı kesmek için bir bahane değil"" diye konuştu. Bill Gates, ""Her yıl paramızı yatırmak için BM'nin bu fonları en etkili yöntemlerden biri"" dedi. Bill Gates Vakfı da Davos'ta 10 yıl önce başlatılan BM'nin söz konusu fonlarına, daha önce 650 milyon dolardan fazla yardım yaptıklarını bildirdi.",1
501,"ADANA (AA)  -  Adana Bilim ve Teknoloji Üniversitesi (BTÜ) personel ve öğrencileri kan bağışında bulundu. Üniversitenin Yeşiloba Yerleşkesi'nde düzenlenen kan bağışı etkinliğinde personel ve öğrenciler, Türk Kızılayı Adana Şube Başkanlığından gelen ekibin yardımıyla bağışta bulundu. Kan bağışlayan gönüllüler, <ihtiyaç sahiplerine> ulaşacak her damla kanın çok önemli olduğunu belirterek, mutluluklarını dile getirdi. Etiketler: Adana , Adana Haberleri « önceki haber sonraki haber »",1
499,"IHA Eskişehir’in Beylikova ilçesinde engelli 12 vatandaşa tekerlekli sandalye dağıtıldı. Belediye tarafından belirlenen 12 yürüme zorluğu çeken <ihtiyaç sahiplerine> tekerlekli sandalye verildi. Vatandaşlara tekerlekli sandalye dağıtan Belediye Başkan Vekili Ersin Kaya, belediye tarafından araştırarak vatandaşları tespit ettiklerini ve bunun üzerine tekerlekli sandalyeleri ihtiyaç sahiplerine verdiklerini söyledi. Etiketler: Eskişehir , Eskişehir Haberleri « önceki haber sonraki haber »",0
