num,text,label
56,"""Bu Kanun Hükmünde Kararnamenin yürürlüğe girdiği tarihi izleyen <aybaşından> itibaren, 2547  sayılı Kanun ile, bu Kanunun ek ve tadilleri uyarınca 1987 yılı  Aralık ayında ad çekme işlemine tabi olanlar ile herhangi bir nedenle kurul  üyeliğinden ayrılanların yerine, bu kanun Hükmünde Kararnameye göre seçimler ve atamalar  yapılır.""",0
624,"Merkez Mahallesi'ndeki deprem konutlarında oturan Tahir Ç. (33), eşi Ayşe Ç'nin evde olmadığı sırada 3 yaşındaki oğlu Muhammed ve 5 aylık ikizleri Sultan ile İbrahim'i bıçakladı. Çocuklar, olay yerinde yaşamlarını yitirdi. Sesleri duyan çevre sakinlerinin durumu bildirmesi üzerine eve gelen polis ekibi, <madde> bağımlısı olduğu bildirilen Tahir Ç'yi gözaltına aldı. Olayla ilgili soruşturma sürdürülüyor.",1
130,"Barcelonalı futbolcu Arda Turan ailesiyle <birlikte olduğu> bir fotoğrafını takipçileriyle paylaştı. Yıldız futbolcu uçakta çektirdikleri aile fotoğrafının altına, 'Ailesiyle vakit geçirmeyen erkek asla gerçek bir erkek olamaz !!!' notunu düştü. Turan'ın bu paylaşımı kısa sürece binlerce beğeni almayı başardı.",0
190,"DIŞ HABERLER Raporda, Türkiye’de görüşülen 18 - 24 yaş arasındaki gençlerin yüzde 58’inin <cinsel ilişkiye girmiş> olduğu açıklandı. Bunların yüzde 48’i korunmasız cinsel ilişki yaşadığını söyledi. Bu yüzde 48’in yüzde 11’i ise bunun nedeninin karşı tarafın kullanmak istememesi olduğunu dile getirdi. Etiketler:",1
28,"""Örneğin , <aybaşında> olan kadınların terini koklayan hemcinslerinin regl günlerinin değişikliğe uğradığı saptandı .""",1
306,"Las Vegas'ta sahneye çıkan Britney Spears, 'I Love Rock 'N' Roll' şarkısını seslendirdiği sırada büstiyerinin askısı açıldı. 34 yaşındaki ABD'li sanatçı, <göğsünün> görünmesini engellemek için eliyle sütyenini tutarak şarkı söylemeye devam etti. Sahnede bulunan dansçılar, şarkıcının imdanına yetişerek büstiyer askısını tekrar bağladı. İŞTE O ANLAR",1
700,"Salık'ın cenazesi, Adana Adli Tıp Kurumu'nda yapılan otopsinin ardından yakınları tarafından alınarak İskenderun Devlet Hastanesi morguna getirildi. Salık'ın <naaşı> daha sonra hastaneden alınarak cenaze namazının kılınacağı İskenderun Kaptan Mehmet Paşa Camii'ne getirildi. Cenaze töreninde Salık'ın çocukları tabuta sarılarak göz yaşları döktü. Hatay Müftüsü Mustafa Sinanoğlu'nun kıldırdığı cenaze namazının ardından Salık'ın naaşı Çankaya Mezarlığı'nda toprağa verildi.",1
15,"KÜLTÜR SANAT SERVİSİ 87 yaşında solunum yetmezliği nedeniyle <aramızdan ayrılmasıyla> sevenlerini ve okuyucularını yasa boğan Koraman, uzun yıllar Milliyet gazetesinde çizdi. Koraman, ağır konuları ele aldığı siyasi karikatürlerinde umutsuzluk değil neşeye yer vermesi ve teknik hakimiyetiyle kuşağının önde gelen çizerleri arasında özel bir yere sahipti. Etiketler: bugün , Bodrum",1
738,"Juventus'un Fransız savunmacısı Patrice Evra'nın sosyal medyadaki renkli paylaşımları devam ediyor. Patrice Evra dün Instagram hesabından yaptığı paylaşımla ırkçılığa karşı eğlenceli bir tepki gösterdi. Panda kostümü giyerek dans eden Fransız futbolcu, videonun ortasında dansına ara vererek, ""Panda gibi. <Siyahım>, beyazım, Asyalıyım ve tombulum. Sevgiyle doluyum, bu oyunu seviyorum. Irkçılığa hayır de"" diyerek dansına kaldığı yerden devam etti.",1
751,"İBRAHİM ÇOBAN DHA Acar, Obama’ya benzerliğini seçim kampanyasında kullanıp, ""Akalan’ın Obaması geliyor"" yazılı afiş ve broşür bastırdı. Bunları evlere ve kahvehanelere dağıtarak seçmenlerden oy isteyen Acar, ""Ben <siyahi> değilim ama esmer olduğum için çok benzetiyorlar"" diyor. Etiketler: ABD",1
455,"DENİZLİ (AA)  -  Eski milli futbolcu Rıdvan Dilmen'in annesi Makbule Dilmen, Denizli'de tedavi gördüğü hastanede hayatını kaybetti. Denizli'de Özel Odak Tıp Merkezinde 17 Aralık'tan beri solunum yetmezliği nedeniyle tedavi gören Makbule Dilmen, 80 yaşında <hayata gözlerini yumdu>. Makbule Dilmen'in cenazesinin, yarın Aydın'ın Nazilli ilçesinde toprağa verilmesi bekleniyor. Etiketler: Rıdvan Dilmen , Denizli , Nazilli , Aydın , Denizli Haberleri « önceki haber sonraki haber »",1
537,"Şanlıurfa'nın Suruç ilçesinde dün canlı bomba saldırısı gerçekleştirildi. Saldırıda Sosyalist Gençlik Dernekleri Federasyonu üyesi gençler hayatını <kaybetti>, 100'e yakın genç de yaralandı. TARKAN TEPKİSİZ KALMADI Megastar Tarkan, ölenlerin ailelerine başsağlığı, yararlılara ise şifa dileklerini ileterek, ""Kendimizi güvende hissettiğimiz, huzurla uyuyup umutla uyandığımız bir Türkiye hayalimin gerçek olması dileğiyle"" yazdı.",1
644,"Mustafa Paşa Mahallesi'nde Fahri Belen Kışlası önündeki bir otomatik para çekme makinasının yakınlarında şüpheli bir poşet bulunduğu bilgisini alan polis, olay yerinde çevre güvenliği aldı. Polis ekibinin yaptığı incelemede poşet içinde saat ve patlayıcı <madde> düzeneği bulundu. Düzenek, bomba imha ekibi tarafından etkisiz hale getirildi.",0
848,"BMD’den yapılan yazılı açıklamada, Doğan’ın yakalandığı amansız hastalıktan kurtulamayarak, dün akşam <vefat ettiği> belirtildi. Doğan’ın cenazesinin ise yarın (bugün) Fatih Camisi’nde kılınacak namazın ardından toprağa verileceği bildirildi. BMD Başkanı Sami Kariyo'nun yaptığı açıklamada; ""Adil, nazik ve bilge kişiliğini saygıyla izleyerek, çok şey öğrendiğim değerli başkanımızı, köklü bilgi birikimi, Türkiye perakendesinin daha da gelişmesine yönelik liderliği ile hatırlayacağız."" denildi.",1
729,"""Kardeşim, bu kadınların büyük çoğunluğunun <seks işçisi> olduğunu bilmiyor  musun?""",1
829,"Spor Toto Basketbol Ligi ekiplerinden Galatasaray Odeabank'ın ABD'li basketbolcusu Blake Schilb'in erkek kardeşi, <vefat etti>. Sarı - kırmızılı kulübün internet sitesinden yapılan açıklamada, ""Basketbolcumuz Blake Schilb'in, bir süredir kanser tedavisi gören 25 yaşındaki erkek kardeşi, maalesef hayata veda etti. Oyuncumuza ve tüm ailesine başsağlığı diliyoruz"" ifadeleri kullanıldı. Schilb'in, cenaze törenine katılmak üzere ABD'ye gittiği de kaydedildi.",1
332,"Merkez Karatay ilçesi Emirgazi Mahallesi Ahmet Hamdi <Göğüs> Caddesi'nde, çocuklar arasında tartışma çıktı. Ailelerin de müdahalesiyle kavgaya dönüşen olayda Recep Esen (22) bacağından, Selim Esen (26) ise elinden bıçakla yaralandı. Yakup Esen (45) de darp edildi. Yaralılar, Konya Eğitim ve Araştırma Hastanesinde tedavi altına alındı. Olay yerine gelen polis yaşanan gerginliği sona erdirmek için yoğun çaba harcadı. Başlatılan soruşturma sürüyor.",0
842,"Sivas'ta yaklaşık 1.5 yıldır görev yapan Vali Kemelek'e, bir süre önce karaciğer nakli yapıldı. Turgut Özal Tıp Merkezi'nde tedavisi devam eden ve bir türlü sağlığına kavuşamayan 60 yaşındaki Zübeyir Kemelek'in durumu birkaç gün önce kötüleşti. Evli ve 3 çocuk babası olan Vali Kemelek'in, doktorların tüm çabasına karşın bu sabah <vefat ettiği> açıklandı. Vali Zübeyir Kemelek'in ölümü, görev yaptığı Sivas'ta büyük üzüntü yarattı",1
71,"Rockçı ünlüler kulübünün üyesi Stewart ile eşi Penny Lancaster (39), ikinci çocuklarını <bekledikleri> açıklayarak, mutlu haberi haziran ayında, evliliklerinin üçüncü yıldönümünde öğrendiklerini belirttiler. On yıldır beraber olan Stewart ile Lancaster'in 4 yaşında Alastir adlı bir oğulları daha var. Stewart'ın önceki ilişkilerinden 5 çocuğu var.",1
112,"ABD basınına yansıyan bilgilere göre Fildişili ünlü forvet Montreal Impact ile 18 aylık için 3 milyon dolara imza attı. 37 yaşındaki oyuncunun Chicago Fire takımı ile görüştüğü de belirtildi. Önümüzdeki saatlerde transfer işleminin kesinlik kazanması <bekleniyor>. Didier Drogba, 2012'de ABD Ligi'nden gelen teklifleri geri çevirip, Çin Ligi takımı Shanghai Shenhua'ya transfer olmuştu. Drogba'nın Katar'dan gelen cazip bir teklifi ise geri çevirdiği öne sürülmüştü.",0
493,"İZMİR Milliyet Başkan Songül Parlayan, ""Bir Çocuk Sevindir Projesi’nin ilk aşaması Bir Çocuk Giydir’le <ihtiyaç sahibi> 100 öğrenciye giysi yardımında bulunduk. İkinci aşamada Bir Çocuk İyileştir’le sağlık yardımı yapacağız. Sonraki projemiz ise Bir Çocuk Okut... Geleceğe yön verecek öğrencilere gönüllü hizmet etmekten mutluluk duyuyoruz"" dedi. Etiketler:",1
373,"""Heyetin başkanı, şimdi <Hakk'ın rahmetine kavuşmuş> olan Yusuf  Serveroğlu Bey'dir.""",1
82,"AA muhabirinin aldığı bilgiye göre, yeşil - beyazlılar yönetim kurulu üyeleri, transfer listesinin ilk sıralarında bulunan Cristian Baroni ve Samuel Holmen için yaptıkları görüşmelerde hem Fenerbahçe Kulübü'nden hem de oyunculardan olumlu sonuç aldı. Bursaspor Yönetim Kurulu, her iki oyuncuya transferleri Ramazan Bayramı'nın hemen ardından sonuçlandırmak istediklerini bildirdi. Baroni'nin ve Holmen'in de yeşil - beyazlıların bu teklifi için bayram sonrasını <bekledikleri> öğrenildi.",0
902,"İsviçre'nin Davos kentinde düzenlenen 42. Dünya Ekonomik Forumu'na katılan Gates, burada yaptığı açıklamada, ""Bu sıralar zor bir ekonomik dönemden geçiyoruz, ancak bu durum <yoksulların> kalkınmasına yardımı kesmek için bir bahane değil"" diye konuştu. Bill Gates, ""Her yıl paramızı yatırmak için BM'nin bu fonları en etkili yöntemlerden biri"" dedi. Bill Gates Vakfı da Davos'ta 10 yıl önce başlatılan BM'nin söz konusu fonlarına, daha önce 650 milyon dolardan fazla yardım yaptıklarını bildirdi.",1
153,"Mustafa Denizli, 1977'de evlendiği, kızı Selin'in annesi Jülyet Aruh'tan 1989'da boşanmıştı. 14 yıl Çiğdem Kayalı ile <birlikte oldu>. Kızları Lal dünyaya geldi. Posta Gazetesi'nin haberine göre; 67 yaşındaki futbol adamı, Temmuz 2010'da kendinden 25 yaş küçük Evin Elçi ile evlendi. Mustafa - Evin Denizli çiftinin boşanacağı belirtildi.",0
246,"Belediye başkan adayları tanıtım programı çerçevesinde Van'daki AKP İl Teşkilatının önünde konuşma yapan Milli Eğitim Bakanı Hüseyin Çelik' e bir esnaf işlerinin kötüye gittiği gerekçesiyle ayakkabı fırlatmak istedi. Partililerin müdahale etmesi üzerine protesto girişimi sonuçsuz kalan kişi gözaltına alındı. Emniyet Müdürlüğü'nde sorgulanan kişinin ayakkabı tamirciliği yapan Çetin İşik olduğu, <ekonomik> krizden dolayı işlerinin kötüye gitmesi nedeniyle böyle bir protestoda bulunduğu öğrenildi.",0
234,"Monti, ABD'de katıldığı bir konferansta yaptığı konuşmada, <ekonomik> zorlukların AB'yi bazı yapısal sorunları ile yüzleştirdiğini ve bunların çözümüne zorladığını belirtti. İtalya Başbakanı, ""AB, krizleri yönetmek amacıyla kurulmadı. İnanıyorum ki bu makinede bir güncellemeye şahit olmaktayız"" diye konuştu. Birlikten ayrılan değil, ona dahil olan ülkeler gördüğünü belirten Monti, AB ve Avro Bölgesi'nin gelecek yıllarda büyüyeceğini öngördüğünü söyledi.",0
584,"Ankara'nın Polatlı çıkışındaki bir tuğla fabrikasında çalışan Ramazan Pehlivan (45), forkliftle fırınlanmamış tuğlaları istif ederken, aracın kontrolünü <kaybetti>. Devrilen forkliftin altında kalan Pehlivan, olay yerinde öldü. Pehlivan'ın cesedi, Polatlı Belediyesi Cenaze aracıyla Duatepe Devlet Hastanesi morguna kaldırıldı. Ramazan Pehlivan'ın 8 yıldır fabrikada çalıştığı ve 2 çocuk babası olduğu öğrenildi.",0
672,"Mustafa Balbay, AKP’nin 48 <madde> geçerse tutuklu vekiller sorunu çözülebilir teklifine şu sözlerle tepki gösterdi: ""AKP’nin Anayasa değişikliği karşılığı milletvekillerine özgürlük önerisini kınıyorum. Özgürlük pazarlığa tabii değildir"" Balbay, 5 Ağustos’ta görülecek karar duruşması öncesi vatandaşları Silivri’ye çağırdı : ""5 Ağustos’ta hükmü değil, halkı bekliyoruz""",0
260,"Bedensel <Engelliler> Basketbol Federasyonu, 26 Mayıs tarihinde Kanada'daki özel turnuvaya giden Milli Takım kafilesinin yer aldığı uçakta, oyuncusu Mustafa Muhittinoğlu'nu yumrukladığı gerekçesiyle hakkında soruşturma açtığı koç Harman Yazıcıoğlu'nun görevine son verdi. Yazıcıoğlu'nun yerine ise sezonu şampiyon tamamlayan BJK RMK Marine'nin koçu Tacettin Çıpa'nın getirildiği açıklandı. (Hürriyet) Bedensel engelli sporcuya antrenöründen yumruk!",1
263,"<Engelli> satıcının tüm çiçeklerini alan Halil Sezai, aldığı gülleri ne yapacağını bilemedi. Meşhur İsyan şarkısının duayen ismi Halil Sezai, önceki akşam yapımcısı Ahmet Çelenk ve bir kadın arkadaşı ile Taksim'deki bir gece kulübündeydi. Şarkıcı, çıkışta çiçek satan engelli vatandaşı görünce cebinde kalan son 50 lirayı vererek bütün çiçekleri aldı. Ardından ""Bu gülleri aldım da kime vereceğim"" diyerek gülmeye başladı.",1
467,"ABD'li ünlü televizyon yapımcısı Aaron Spelling 83 yaşında <hayata gözlerini yumdu>. 18 Haziran'da inme geçiren ünlü film yapımcısı, önceki gün Los Angeles kentindeki evinde öldü. Kısa bir süre sinema oyunculuğu da yapan Spelling, pek çoğu Türkiye'de de gösterilen Charlie'nin Melekleri, Hanedan, Aşk Gemisi, Hayal Adası, Evimiz Hollywood'da gibi birçok televizyon dizisinin yapımcılığını üstlenmişti.0",1
877,"AFP'nin haberine göre Nijerya'nın Lagos kentinde inşaatın çökmesi sonucu 30 kişi hayatını kaybetti. 13 kişinin sağ olarak kurtarıldığı açıklanırken, göçük altında kalanlar olabileceği söyleniyor. Lagos'ta ucuz malzemelerin kullanılması ve denetim olmaması sebebiyle kentin <yoksul> bölgelerinde benzer olayların sıklıkla yaşandığı belirtiliyor.",1
805,"Oyuncu, yazdığı notla duygularını paylaştı: ""Bugün benim bitanemin doğum günü. Sen büyüdükçe, yerdeki legolara basıp ayağımın acımasını, küçük ellerinle parmağımı kavradığın ilk anı ve her gece sana masal uydurarak <uyutmayı> özlüyorum. Hayretle büyümeni izliyorum. Dünyanın en tatlı, en kafa dengi çocuğu iyi ki doğdun.""",0
193,"FATİH KARAÇALI Adana İlişki sırasında görüntülerini çektiği ileri sürülen Can Ç. ile Y.G. daha sonra ayrıldı. Ayrılığın ardından bazı kişiler Y.G.’yi, ""Elimizde cinsel içerikli görüntülerin var, bizimle birlikte olmazsan bunu sosyal paylaşım sitesi üzerinden yayınlarız"" diyerek tehdit etti. Tehditlerden korkan genç kız, mesaj atan kişilerle buluşup <cinsel ilişkiye girdi>. Olayla ilgili 8 kişi gözaltına alındı, 2 kişi aranıyor. Etiketler: Adana , Facebook",1
825,"İNSANA en çok benzeyen hayvan olarak bilinen şempanzeler, yavrularını titizlikle büyütüyor. Anne şempanze, yavrusunu kucağında <uyutuyor> ve gerektiğinde battaniyeyle üstünü örtüyor. GEBZE'NİN Darıca beldesinde bulunan Boğaziçi Hayvanat Bahçesi'ndeki ""Tsunami"" adlı şempanze yavrusu 4.5 aylık oldu. Hayvanat bahçesinde 5 Ocak'ta doğan ve Türkiye'deki hayvanat bahçelerinde dünyaya gelen ilk şempanze olan ""Tsunami"", herkesin ilgi odağı oldu.0",0
354,"Anıtın kafa, omuz ve <göğüs> kısımlarının kesilmesinin ardından yedinci parçanın kesimi için karotla delik açıldı. Elmas uçlu makineyle kesilen parçalar, numaralandırıldıktan sonra Kars Belediyesinin belirlediği depoya kaldırılıyor. Heykelin, 18 parça halinde kaldırılması planlanıyor.",0
35,"""Bronşit selülit , saç, <aybaşı>, güneş yanması, yüksek tansiyon, ödem , romatizma gibi rahatsızlıklara iyi gelmektedir.""",1
7,"Sarı - kırmızılı kulübün internet sitesinde yer alan mesajda, ""Teknik direktörlük yaptığı 1984 - 1988 yılları arasında Galatasaray'a unutulmaz başarılar yaşatan, aynı zamanda Türk futbolunun gelişimi için büyük katkılar sağlayan Jupp Derwall'i <aramızdan ayrılışının> 7. yılında özlem ve saygıyla anıyoruz"" denildi. Derwall, 1986 - 1987 futbol sezonunda 14 yıl aradan sonra ligde şampiyonluğa ulaşan sarı - kırmızılı takımın teknik direktörüydü.",1
363,"Polisin olay yerine gelmesinin ardından‘Grand Theft Auto’ isimli şiddet içeren bir bilgisayar oyunu oynayan David Helens’in oyunda yaralanan arkadaşı için ihbarda bulunduğu ortaya çıktı. İhbarda arkadaşının <göğsüne> isabet eden bir kurşunla ağır yaralandığını ve kendisinin de saldırıya uğradığını söyleyen David Helens, olay yerine gelen güvenlik güçleri tarafından gözaltına alındı. Olayın ardından hakkında dava açılan Helens, 12 ay kamu hizmetinde çalışma cezasına çarptırıldı. (ntvmsnbc)",0
730,Büyük  çoğunluğu demek yetmez; tüm Rus kadınlara <seks işçisi> diyemediğiniz sürece yapılan  ırkçılıktır.,1
454,"IHA Haberin diğer fotoğrafları için tıklayın Türkiye Cumhuriyeti’nin kurucusu Mustafa Kemal Atatürk, ebediyete intikalinin 77. yılında tüm yurtta olduğu gibi Sungurlu’da da anıldı. Atatürk’ün <hayata gözlerini yumduğu> saat 09:05’de sirenlerin çalmasıyla birlikte vatandaşlar, 1 dakikalık saygı duruşunda bulundu. Bazı vatandaşlar araçlarından inerek saygı duruşunda bulundu. Etiketler: Atatürk , Mustafa Kemal Atatürk , Çorum Haberleri « önceki haber sonraki haber »",1
344,"Süpermen'in çıkan ilk çizgi romanı 2 hafta önce satışa çıkarılmıştı; açık artırmaya 89 kişi teklif sundu. Dergiyi alanın da satanın da kimliği açıklanmadı. 1938'de dergi, 10 sente satılıyordu. Kripton gezegeninden gelen Süpermen, dergi kapağında korku dolu gözlerle kaçışan insanların arasında, <göğsünde> S harfi, üzerinde mavi kostüm ve kırmızı peleriniyle yeşil bir otomobili kaldırıp fırlatmaya hazırlanırken görülüyor. Süpermeni, Jerry Siegel ve Joe Shuster adlı iki Amerikalı genç çizmişti.",0
558,"Kanser tedavisi gördüğü hastanede dün hayatını <kaybeden> sanatçı Murat Göğebakan, son yolculuğuna uğurlandı. Cenaze törenine Başbakan Recep Tayyip Erdoğan yanı sıra sanatçılar, Göğebakan'ın yakınları ve sevenleri katıldı. Cenaze töreninin ardından Erdoğan, Göğebakan'ın tabutuna omuz verdi. Fatih Camii'nde kılınan cenaze namazın ardından Göğebakan'ın cenazesi toprağa verilmek üzere Adana'ya gönderildi. MURAT GÖĞEBAKAN'A VEDA - FOTO GALERİ",1
546,"Yetkililer şu ana kadar herhangi bir yaralanma ya da hasar raporu veya tsunami uyarısı olmadığını söyledi. 6,4 büyüklüğündeki deprem Sumatra adasının 50 kilometre uzağında ve yerden 38 kilometre derinlikte meydana geldi. 2004 yılının Aralık ayında Sumatra adası açıklarında meydana gelen 9.1 büyüklüğündeki depremin ardından tsunami olmuştu ve afette 230 bin kişi hayatını <kaybetmişti>.",1
340,"Adnan Menderes Bulvarı'ndaki bir evden silah sesi gelmesi üzerine çevredekiler polise haber verdi. Eve giden polis, A.B'nin birahanede garson olarak çalışan, birlikte yaşadığı Bahar A'yı  (29) av tüfeğiyle vurarak öldürdükten sonra <göğsüne> ateş ederek intihar girişiminde bulunduğunu belirledi. Ağır yaralanan A.B, Bergama Devlet Hastanesi'ne kaldırıldı.",0
480,"AA Aşağı Mahalle’de oturan vatandaşların ""155 Polis İmdat Hattı""na gıda ihtiyaçları bulunduğunu bildirmesi üzerine güvenlik güçleri, zırhlı araçlara yükledikleri gıda maddeleriyle adreslere gitti. Çevre güvenliğinin alınmasının ardından gıda malzemeleri <ihtiyaç sahibi> ailelere teslim edildi. Etiketler: afad",1
50,"""Arketipsel olarak Kırmızı Ayakkabılar'ın <aybaşı> kanamalarının başlaması ve anne tarafından daha  az korunan bir hayata geçilmesi, genç bir kadına kendisinden büyük kadınlar  tarafından dış dünyanın farkında olma ve ona tepki gösterme yollarının öğretilmesiyle ilgili  çok eski bir öykü ya da mitin üst üste binen parçalarından biri  olması mümkündür.""",1
393,"""Gerçi Al Capone 1947'de  <hakkın rahmetine kavuştu> ama ne tanrı'nın, ne de Amerikan gangsterlerinin çalışma  tarzı açısından pek bir şey değişmiş değil; misal, Amerikalıların canı  daha fazla petrol istediğinde herhangi bir ülkeyi talan edebiliyorlar.""",1
115,"Rahatsızlığı nedeniyle dün hastaneye yatırılan Mert Nobre'nin oğlu Nicolas'ın başında bir hemşirenin sürekli <beklediği> kaydedildi. Beşiktaş Kulübü'nden yapılan açıklamada, 1 Mart Pazartesi gününe kadarki sürecin önemli olduğu, bu sürede tedaviye devam edileceği bildirildi.",0
569,"Polis yetkilisi, kentin Muzafferabad bölgesinde kaynağı henüz belirlenemeyen patlamada hayatını <kaybedenlerden> birini polis olduğunu, yaralı olarak hastahaneye sevk edilenlerin tamamının durumunun ağır olduğunu söyledi. Patlamanın gerçekleştiği bölgenin yakınında bulunan NATO ikmal araçlarının hasar görmediği belirtildi.",1
303,"Scott Moore ve evli olduğu Thomas, aslında kız olarak dünyaya geldiler. Scott, <göğüslerini> aldırdı ama cinsiyet değiştirme ameliyatı olmadı. Thomas ise cinsiyet değiştirme operasyonuyla erkek oldu. Terapi grubunda buluşan ikili, 2007 yılından beri birlikte. Scott, 2009’da bir erkek arkadaşından alınan spermle hamile kaldı. Bebek, Şubat ayında doğacak. Dünyanın ilk hamile erkeği Thomas Beatie, 14 Temmuz 2008’de kızı Susan Juliette Beatie’yi dünyaya getirmişti.",1
232,"Ankaralı Akın Karanfil, 1994 <ekonomik> kriz ve döviz kurlarındaki değişikliklerini gerekçe göstererek, 1992 yılında bir banka ile imzaladığı kredi kontratındaki geri ödeme koşullarının iyileştirilmesi talebiyle başlattığı yargı sürecinin ancak 2006 yılında sonuçlanması nedeniyle AİHM'ye yaptığı şikayete ilişkin açılan davada Türkiye haksız bulundu. Bunun üzerine AİHM, adil yargılanma hakkının ihlal edildiğine hükmederek Karanfil'e 8 bin 400 Avro manevi tazminata ödemesine karar verdi.",0
782,"ABD'NİN Cape Cod koyunda karaya vuran 9 balina ve 24 yunus öldü. Karaya vuran hayvanlarla ilgili çalışmalarda bulunan ""Cape Code Stranding Network (Cape Cod Karayavuruş Şebekesi) yetkilisi Kristen Patchett, hayatta kalan 5 balina ile 7 yunusun ise <uyutulması> gerektiğini belirtti. Yetkililer, geçen Cuma günkü kar fırtınasının etkisiyle oluşan rüzgârların balina ve yunusların sığ sularda mahsur kalmalarına yol açmış olmasından şüpheleniyor.0",1
529,"""Hayır korkmadım, gerçekten uzun zamandır bu kadar  çok korkmadım... Genellikle korkmam için hayalet, <iyi saatte olsunlar> veya  yerinden kendiliğinden oynayan eşyalar gerekir.""",1
616,"Hülya Avşar, Atv'de Okan Bayülgen ve Hıncal Uluç' un jüri olarak yer aldığı 'Çek Bakalım' adlı yeni programda yine jüri üyeliği yapacak. Temmuz sonunda Atv'de ekrana gelecek programda sosyal medyadaki kısa videolar Okan Bayülgen, Hıncal Uluç, Hülya Avşar üçlüsü tarafından değerlendirilecek. Avşar geçtiğimiz haftalarda TNT'de sunduğu şov programının sezon finalini yapmış ve kanalın yeni yayın dönemi atağına <kurban gittiği> öne sürülmüştü.",0
365,"Ankara Çankaya'da Şehit Mustafa Doğan Caddesi'nde başlatılan kaldırım bakım onarım çalışmasında <görme engellilerin> ulaşımlarını sağlayabilmeleri için hazırlanan şeritlerden kullanıldı. Ancak şeritlerin görme engelli yurttaşları bir yere ulaştırmadığı aksine desen olarak kullanıldığı görüldü. Kaldırıma dik döşenen şeritler Ankaralıların tepkisini toplarken, Belediyeye ve Belediye Başkanı Melih Gökçek'e tepki yağdı.",1
224,"Dış <Ekonomik> İlişkiler Kurulu'ndan (DEİK) yapılan yazılı açıklamaya göre kurul, 12–15 Şubat 2009 tarihleri arasında Cumhurbaşkanı Abdullah Gül'ün Rusya ve Tataristan ziyareti sırasında Moskova ve Kazan'da ortak toplantılar düzenleyecek. Açıklamada, ""Türkiye'den çok sayıda iş adamının da eşlik edeceği ve Abdullah Gül'ün de yer alacağı toplantılar, sektörel görüşmeler ve yeni işbirliklerinin görüşülmesi için önemli bir platform olacak"" denildi.",0
8,"Onur Aydın’ın ‘Yağmur - Kıyamet Çiçeği’ kitabından aynı isimle beyazperdeye aktarılan ve amansız hastalığı nedeniyle 33 yaşındayken <aramızdan ayrılan>, Kazım Koyuncu’nun hayatının bir bölümünün anlatıldığı ‘Yağmur - Kıyamet Çiçeği’ filmi sanatçının 43’üncü doğum günü olan 7 Kasım’da vizyona girecek. Filmin oyuncu kadrosunda Engin Hepileri, Altan Erkekli, Devrim Saltoğlu, ve Sevtap Erkan Köstengil yer alıyor.",1
518,"""Atlar istediği kadar kusursuz ve hızlı olsun, jokeyler istediği kadar dünyanın  en büyük isimleri olsun, <iki canlı> arasında yapılan geçici kader birliğinin  mutlu sona ermesi için mutlaka ama mutlaka psikolojik köprüler gerekir.""",0
768,"<Siyahi> bir erkeğin eşlik ettiği klibi tanıtmak için sabırsızlandığını belirten Emmelie De Forest You Tube’de hayranlarının fikirlerini sordu. Direktörlüğünü Mike Spooner, Prodüktörlüğünü Mads Mardstand’ın yaptığı Drunk Tonigtht (bu gece sarhoş) adlı klipte cesur pozlar veren Emnelie De Forest hayranlarından tam not aldı. Emelie de Forest Face Book sayfasında hayranlarına ""işte resmi video görüntülerim, ne düşünüyorsunuz? sorusunu yöneltti.",1
