num,text,label
476,"Ayrıca isteyenler, bu kolileri Kızılay aracılığıyla <ihtiyaç sahiplerine> ulaştırabiliyor. 12 çeşitten oluşan ‘Bereket’ kolisinin fiyatı 21.90 lira, 17 çeşitten oluşan ‘Lezzet’ kolisi 32.90 lira ve 22 çeşitten oluşan ‘Ziyafet’ kolisinin fiyatı ise 44.90 lira. Etiketler: Migros , Kızılay , Ramazan",0
94,"Çek Cumhuriyeti'nin kuzeyinde seçmenlerle görüşen Miloş Zeman, ""Türkiye, AB'ye üye yapılmamalı"" dedi. AB'nin Türkiye'ye 3 milyar euro yardım yapmasını eleştiren Zeman, ""Türkiye, bu sığınmacılara bakacak güçte, çünkü bu insanlar onlarla aynı dinden"" dedi. Türkiye'yle ilişkilerin dikkatli bir şekilde inşa edilmesi gerektiğini savunan Çek Cumhuriyeti Devlet Başkanı, ""Bu ifadelerimden dolayı Türk Büyükelçisi'nin Prag Kalesi'ne protesto notu göndermesini <bekliyorum>"" dedi.",0
584,"Ankara'nın Polatlı çıkışındaki bir tuğla fabrikasında çalışan Ramazan Pehlivan (45), forkliftle fırınlanmamış tuğlaları istif ederken, aracın kontrolünü <kaybetti>. Devrilen forkliftin altında kalan Pehlivan, olay yerinde öldü. Pehlivan'ın cesedi, Polatlı Belediyesi Cenaze aracıyla Duatepe Devlet Hastanesi morguna kaldırıldı. Ramazan Pehlivan'ın 8 yıldır fabrikada çalıştığı ve 2 çocuk babası olduğu öğrenildi.",0
171,"New England Journal of Medicine tıp dergisinin haberine göre, adı belirtilmeyen bir erkek, partneriyle <cinsel ilişkiye girmek> isterken penisinden bir anda ses geldi. Kısa bir süre sonra cinsel organında meydana gelen kanama ve ağrılarla hastaneye kaldırılan adam acil olarak ameliyata alındı. ""Corpus cavernosa"" adı verilen ve penisin erekte olmasını sağlayan süngerimsi doku ameliyatla dikildi. Tıp dergisine göre hasta altı ay sonra tamamen eski sağlığına kavuşmayı başardı.",1
139,"Kara Sevda' dizisinde Leyla karakterini canlandıran Zerrin Tekindor, sevgilisi Haluk Bilginer ile tatil için Fransa'ya gitti. Yaklaşık 2 yıldır <birlikte olan> Zerrin Tekindor ve Haluk Bilginer Colmar'a tatile gitti. Tekindor, çektikleri selfie'yi Instagram sayfasında takipçileri ile paylaştı.",0
367,"1  -  Halterde <Görme Engelliler> Büyükler Türkiye Şampiyonası Ankara'da yapılacak. Şampiyona, 19 - 20 Şubat günleri Ankara Gençlik ve Spor İl Müdürlüğünün daha sonra belirleyeceği salonda gerçekleştirilecek. Şampiyonada sporcular, bayanlar ve erkeklerde benc press ile powerlifting kategorilerinde mücadele edecek. Müsabakalara katılmak isteyen kulüplerin, 17 Şubat Perşembe gününe kadar federasyona başvurmaları gerekiyor.",1
354,"Anıtın kafa, omuz ve <göğüs> kısımlarının kesilmesinin ardından yedinci parçanın kesimi için karotla delik açıldı. Elmas uçlu makineyle kesilen parçalar, numaralandırıldıktan sonra Kars Belediyesinin belirlediği depoya kaldırılıyor. Heykelin, 18 parça halinde kaldırılması planlanıyor.",0
389,"""Adamın serveti  trilyonları bulurken, bilmem ne yoluna niyazi vaziyetlerinde <hakkın rahmetine kavuşan> 100  küsur Amerikan askerinin cesetlerinin ve târ ü mâr olan Iraklı anaların ve  çocukların kopan kol ve bacaklarının üzerinden maaş zammı almak da neyin nesi ?""",1
107,"Beşiktaş Erkek Basketbol Takımı, Curtis Jerrells'ın yerine yeni bir ABD'li oyun kurucuyu kadrosuna kattı. Siyah - beyazlı ekip, 31 yaşında ve 2 metre boyundaki Ricky Minard ile sözleşme imzaladı. Beşiktaş Kulübü Basketbol Komitesi Başkanı Abdullah Sözer, AA muhabirine yaptığı açıklamada Minard ile sözleşme imzaladıklarını belirterek, ""FIBA'dan belgelerini <bekliyoruz>. Bir aksilik olmazsa bu oyuncu yarın İstanbul'a gelecek. Jerrells ile de yollarımızı ayıracağız"" diye konuştu.",0
541,"Maden İşleri Genel Müdürlüğünde görevli olduğu öğrenilen Sedat Kahveci (34), evrak teslim etmek için bakanlığın Balgat'taki binasına geldi. Bakanlık binasının altıncı katında yangın merdivenine çıkan Kahveci, düşerek hayatını <kaybetti>. Kahveci'nin cesedi, savcılık incelemesinin ardından, otopsi için morga kaldırıldı. Sedat Kahveci'nin, daha önce uzman çavuş olarak görev yaptığı bildirildi. Olayla ilgili soruşturma sürüyor. Fotoğraf: Temsilidir",1
176,"DIŞ HABERLER SERVİSİ Ross, Sheen’in kendisine şiddet uyguladığı ve sürekli olarak tehdit ettiği iddiasıyla mahkemeye gitmişti. Ross’un avukatı David Ring ""Ross’un güvenliği için Los Angeles Polis Departmanı kadınla iletişime geçti ve Sheen’i uzakta tutmak için ‘yasaklama emri’ çıkardı"" dedi. Eski porno yıldızı Ross, Sheen’in HIV pozitif olduğunu belirtmeden <cinsel ilişkiye girdiği> suçlamasında da bulunuyor. Etiketler: ABD , Los Angeles",1
436,Kilise cemaati durumu farkettikten sonra acilen polise başvurdu. Papanın kanı Roma yakınlarındaki San Pietro della lenca kilisesinde altın bir şişenin içinde saklanıyordu. Kiliseye giren hırsızların içeride başka değerli şeyler olmasına rağmen sadece eski Papa’nın kanını çalması dikkat çekti. Papa II. Jean Paul’ün kan örnekleri 13 Mayıs 1981 yılında Mehmet Ali Ağca’nın kendisine suikast girişimi sırasında toplanmış ve şişelenmişti. Papa Jean Paul 2005 yılında <hayata gözlerini yummuştu>.,1
498,"AĞRI (AA)  -  Ağrı Emniyet Müdürlüğü Toplum Destekli Polislik Şube Müdürlüğü ekipleri, <ihtiyaç sahibi> öğrencilere kırtasiye yardımında bulundu. ""Güvenli Hayat ve Güvenli Gelecek için Çocuk ve Gençler Sosyal Koruma ve Destek Programı"" (ÇOGEP) kapsamında, kentte okuyan 500 öğrenciye kırtasiye seti dağıtıldı. Büyük mutluluk yaşayan öğrenciler, kırtasiye setlerini dağıtan polislere teşekkür etti. Etiketler: Ağrı , Ağrı Haberleri « önceki haber sonraki haber »",1
368,Bir de tabii umumi  tuvaletlerde yandaki bölmede <hacetini görene> teşaşür sesi gitmesin için teharet musluklarının şar  şar açılıp öylecene bırakılıp gitmesinden filan.,1
406,ALLAH aşkına kaçımız sadece eşini aynı karede başka bir kadınla gördü diye  gidip <hamileligini sonlandırmaya> karar verdi.,1
728,Tüm Rus kadınlara <seks işçisi> muamelesi yapmaya kimin ne hakkı  var?,1
40,"""Gerçekten  de kadınların ritmik, <aybaşı> kanamaları olarak isimlendirdikleri vajinadan gelen kanamalar,  bebeği içinde taşıyacak rahim iç zarının, hormonlar etkisiyle her ay kalınlaşması , ancak gebelik olmadığında artık beslenmesine gerek kalmadığında dışarı atılmasıdır.""",1
659,"Genelkurmay Başkanlığı'nın internet sitesinde verilen bilgiye göre Bitlis'in Merkez ilçesi Döşkaya köyü bölgesinde, güvenlik güçlerince 29 Ekim günü gerçekleştirilen faaliyet sırasında, bölücü terör örgütü mensuplarınca Amonyum ve Potasyum nitrat kullanılarak hazırlanmış ve Bitlis  -  Siirt karayoluna 750 metre mesafede toprağa gömülerek gizlenmiş, 90 kiloluk patlayıcı <madde> bulundu. Bulunan patlayıcı maddenin imha edildiği bildirildi.",0
263,"<Engelli> satıcının tüm çiçeklerini alan Halil Sezai, aldığı gülleri ne yapacağını bilemedi. Meşhur İsyan şarkısının duayen ismi Halil Sezai, önceki akşam yapımcısı Ahmet Çelenk ve bir kadın arkadaşı ile Taksim'deki bir gece kulübündeydi. Şarkıcı, çıkışta çiçek satan engelli vatandaşı görünce cebinde kalan son 50 lirayı vererek bütün çiçekleri aldı. Ardından ""Bu gülleri aldım da kime vereceğim"" diyerek gülmeye başladı.",1
860,"Japonya'da 13 Mart 1903 yılında doğan Koide, geçen sene Guinness Rekorlar Kitabı'na erkekler arasında dünyanın en yaşlı adamı olarak girmişti. Japonya Sağlık Bakanlığı, 112 yaşındaki Koide’nin <vefat etmesiyle>, erkekler arasında dünyanın en yaşlı adamının, Tokyo’da oturan 111 yaşındaki Yoshida Masamitsu’nun olduğunu açıkladı.",1
582,"Tatil için Kartalkaya'ya gelen 3 kişi, kayak yaparken Kındıra Yaylası mevkisinde sis ve tipi nedeniyle pistten çıkarak <kayboldu>. Kaybolan kişilerin cep telefonuyla arayarak yardım istemesi üzerine Kartalkaya Jandarma Arama Kurtarma timi, kar motorlarıyla bölgeye hareket etti. Ekipler, Kındıra Yaylası mevkisinde arama kurtarma çalışması başlattı.",0
775,"Maçın son dakikalarında gelişen atakta pas vermemesi nedeniyle Burak'a sinirlenen Eboue'yi takım sakinleştirmeye çalıştı. Öfkeli olduğu gözlenen Eboue, takım arkadaşlarının ısrarlarına rağmen tribünleri selamlamayı kabul etmedi. <Siyahi> oyuncu tüm ısrarlara rağmen soyunma odasına giderken, Galatasaraylı oyuncular ise 90 dakika boyunca destek veren tribünleri selamlayarak galibiyeti kutladı.",1
159,"AVUKATLARA KESİN TALİMAT VERDİ Seki'yi ziyaret etmek isteyen eski sevgilinin futbolcu Ali Turan olduğu öğrenildi. Eski sevgilisi Ali Turan'ın görüşme isteği üzerine çok sinirlendiği söylenen Seki'nin, avukatına kesin talimat verdiği iddia ediliyor. Şarkıcı, iki yıl önce ayrıldığı Turan'ın ardından şimdiki nişanlısı Faruk Salman'la <birlikte olmaya> başlamıştı.",0
189,"T24 -  Amerika’daki araştırmaya göre, kadınlar sekste en bereketli ve fanteziye açık dönemi 40 yaşına yaklaşırken yaşıyor. En fazla bu yaş grubundaki kadınların <cinsel ilişkiye girdiği> ortaya çıktı. 40’lık kadınların seksüel coşkusunun nedenini bilim adamları açıkladı: 40’ına yaklaşan kadın çocuk doğurma şansı azaldığı için içgüdüsel olarak sekse yatkınlık gösteriyor",1
666,"Örnektepe Köprüsü'ne ucunda şüpheli paket bulunan pankart asıldığını tespit eden polis ekipleri, çevrede güvenlik önlemi aldı. Olay yerine gelen bomba imha ekipleri, paketi fünyeyle patlattı. İncelemede, pakette patlayıcı <madde> olmadığı tespit edildi. Ekiplerin çalışması sırasında E - 5 Karayolu'nun çift yönlü trafiğe kapatılması yoğunluğa neden oldu. Bu sırada seferlerin yapılamaması nedeniyle çok sayıda metrobüs de duraklarda bekletildi. Çalışmaların ardından, trafik normale döndü.",0
726,"Senato tarafından onaylanması beklenen tasarıya göre para ödeyerek fuhuş yapanlar ilk yakalandıklarında bin 500, ikinci yakalanmalarında ise 3 bin 750 Euro ceza ödemek zorunda kalacak. Bu suçu işleyenler ayrıca fuhuşun zararları hakkında kurs görmek zorunda olacak. Fransa'da <seks işçisi> kadınlarının sokaklarda müşteri araması, genelev işletmek ve hayat kadını pazarlamak 2003 yılında yasaklanmıştı.",1
13,"Şenol Güneş’in yönetimin tören düzenleme isteğini geri çevirmesiyle yayınlanan ‘Emeğinize teşekkürler’ mesajında şu ifadelere yer verildi: ""KULÜBÜMÜZE büyük emekleri geçen Güneş ve ekibinin <aramızdan ayrılması> herkesi olduğu gibi bizleri de fazlasıyla üzmüştür. Güneş ve çalışma arkadaşlarına bundan sonraki yaşamlarında sağlık, başarı ve mutluluklar diliyoruz.""",0
130,"Barcelonalı futbolcu Arda Turan ailesiyle <birlikte olduğu> bir fotoğrafını takipçileriyle paylaştı. Yıldız futbolcu uçakta çektirdikleri aile fotoğrafının altına, 'Ailesiyle vakit geçirmeyen erkek asla gerçek bir erkek olamaz !!!' notunu düştü. Turan'ın bu paylaşımı kısa sürece binlerce beğeni almayı başardı.",0
890,"Türkiye Kamu - Sen Konfederasyonu, Temmuz ayı Açlık - <Yoksulluk> Sınırı Araştırması'nı açıkladı. Araştırmaya göre, Temmuz ayında ailenin gıda ve giyim harcamaları azalırken, haberleşme, kira ve ulaşım harcamaları arttı. Bir ailenin açlık sınırının bin 69 TL olduğu belirlenirken, yoksulluk sınırı ise 2 bin 803 TL olarak hesaplandı. Çalışan tek kişinin yoksulluk sınırı bin 400 TL oldu. Dört kişilik bir ailenin aylık gıda harcamasının 608 TL, ortalama kira giderinin ise 466 TL olduğu belirlendi.",1
174,"New England Journal of Medicine tıp dergisinin haberine göre, adı belirtilmeyen bir erkek, partneriyle <cinsel ilişkiye girmek> isterken penisinden bir anda ses geldi. Kısa bir süre sonra cinsel organında meydana gelen kanama ve ağrılarla hastaneye kaldırılan adam acil olarak ameliyata alındı. ""Corpus cavernosa"" adı verilen ve penisin erekte olmasını sağlayan süngerimsi doku ameliyatla dikildi. Tıp dergisine göre hasta altı ay sonra tamamen eski sağlığına kavuşmayı başardı. Etiketler: ABD , Boston",1
520,Eleni zamanında Eftelya’nın anneannesini yakalandığı <ince hastalık>tan Kerim hocanın iyileştirdiğini ve  bunu da aileden gizli yaptığını anlatır.,1
632,"Kartaltepe Mahallesi Kendirli Sokak'ta terk edilmiş bir eve giren ve <madde> bağımlısı olduğu belirtilen kişi, burada ateş yaktı. Bu kişinin kullandığı uçucu maddenin tutuşması sonucu evde yangın çıktı. Olay yerine gelen itfaiye ekipleri, yangını kısa sürede söndürürken, üzerinde kimliğini belirlemeye yarayacak herhangi bir belge çıkmayan ve çevrede ""Hüseyin"" olarak tanınan kişinin cesedine ulaştı. Ceset, gerekli incelemelerin yapılabilmesi için Adli Tıp Kurumu morguna kaldırıldı.",1
487,"IHA Kütahya’nın Emet Kaymakamlığı Sosyal Yardımlaşma ve Dayanışma Vakfı ile Emet Belediyesi’nin ortak organizasyonu her gün bin kişiye iftar yemeği verileceği bildirildi. Hükümet Meydanı’nda kurulacak olan iftar çadırının yanı sıra, hasta ve yaşlılar ile, <ihtiyaç sahibi> evlere yemek ve pide servisi de yapılacağı ifade edildi.(EFE) Etiketler: Kütahya , Kütahya Haberleri « önceki haber sonraki haber »",1
628,"İstanbul Şişli Merkez Mahallesi Kocamansur Sokak'taki bir apartmandaki dairesinde cesedi bulunan avukat Ece Arslan'ın , Adli Tıp Kurumu'nda otopsisi tamamlandı. Arslan'ın otopsi sonucu vücudunda, delici, kesici yara ve darp, uyuşturucu <madde> kullandığına ilişkin bir bulguya rastlanmadığı anlaşıldı. Arslan'ın kesin ölüm sebebinin, vücudundan alınan kan ve doku örneklerinin incelenmesinin ardından belirleneceği öğrenildi. Olayla ilgili soruşturma sürüyor.",1
273,"Mardin Valiliği'nce yapılan açıklamada, olumsuz hava koşulları ve kuvvetli buzlanma nedeniyle Artuklu İlçe Hıfzıssıhha Kurulu Kararıyla Artuklu İlçe merkezi ile kırsal mahallelerinde tüm resmi ve özel okullar ile diğer eğitim kurumlarının bugün için tatil eildiği belirtildi. Açıklamada, ""Ayrıca Mardin İlimizin tüm ilçelerinde <engelli> ve hamile kamu görevlileri de 19 Aralık 2016 Pazartesi günü idari idari sayılmıştır"" denildi.",1
326,"İstanbul'un Sultangazi ilçesine bağlı Gazi Mahallesi'nde dün akşam olaylar çıktı. İbrahim Kaypakkaya anması yapmak isteyen grup ile polis arasındaki olaylar sırasında, yaşananları evinin balkonundan takip eden Pınar Gemsiz <göğsüne> isabet eden kurşunla yaşamını yitirdi. Görgü tanıkları, Gemsiz'in polisin kullandığı akrepten ateş açılması sonucu vurulduğunu aktarırken, olayla ilgili soruşturma başlatıldı.",0
678,"""Yok böyle şey, hepiniz toplanacaksınız haftanın <muayyen günlerinde> bineceksiniz,  bu bizim babamızın malı değildir.""",0
458,"IHA Aydın Esnaf ve Sanatkarlar Odaları Birliği (AYESOB) Başkanı Selahittin Çetindoğan’ın annesi Aynur Çetindoğan vefat etti. Kalp rahatsızlığı nedeniyle bir süredir Aydın Medline Hastanesi’nde tedavi gören Aynur Çetindoğan, dün akşam saatlerinde <hayata gözlerini yumdu>. Çetindoğan’ın cenazesi bugün öğle namazına müteakip Efeler Bey Cami’nde kılınacak cenaze namazının ardından İmamköy Mahallesi’nde toprağa verilecek. Etiketler: bugün , Aydın , Aydın Haberleri « önceki haber sonraki haber »",1
612,"Özgecan'ın annesi Cumhurbaşkanı Erdoğan'a gösterdikleri ilgi ve alakadan dolayı teşekkür etti. Cumhurbaşkanı Erdoğan ve eşi Emine Erdoğan, Mersin'de hunharca bir cinayete <kurban giden> üniversite öğrencisi Özgecan Aslan'ın ailesini telefonla arayarak taziyelerini iletmiş, cinayeti kınamıştı.",1
150,"Lige girdiğinden bu yana kendine has karakteriyle sosyal medyayı fetheden Embiid, 8 Ağustos 2014 tarihinde kişisel Twitter hesabından Rihanna'yı kast ederek attığı, ""Gerçek bu… Bu ünlü kızı tavlamaya çalışıyordum ve o da bana ‘All - Star olduğunda geri dön’ dedi."" şeklindeki paylaşımı alıntıladı ve, ""Nihayet aşık olduğum kadınla <birlikte olabilmek> için şansım var. Bu yüzden yardımınıza ihtiyacım var…"" şeklinde bir tweet daha atarak kendisi için oy istedi.",0
724,"BDP Eş Genel Başkanı Selahattin Demirtaş, twitter de yazdığı mesajda, dün Federal Kürdistan Bölgesi'nin Süleymaniye kentinde YNK yetkilileri ile görüştüğünü söyledi. Bugün İstanbul'a döndüğünü ifade eden Demirtaş, ""Dün Süleymaniye'de YNK yetkilileri ile görüştük. Bugün döndük. Ama İstanbul'da valizim gizli bir şekilde aranmış olarak bana teslim edildi. Valizimde her ne aramışlarsa bilmiyorum ama 'barış' valizden çıkmaz. Bunu bilmeyecek kadar <saf> olmalılar"" dedi.",1
114,"Ekonomistler, işsizlik maaşı için başvuruların 460 bine gerilemesini <bekliyorlardı>. Dört haftalık ortalamalara göre ise başvurular 3 haftadır üst üste artarak 468 bin 750 oldu. Öte yandan, 4,6 milyon olan işsizlik maaşı alanların sayısı ise değişmedi.",0
535,"Alınan bilgiye göre, Yanıklı köyü mevkisinde terör örgütü PKK mensuplarınca yola yerleştirilen el yapımı patlayıcı, iki askeri aracın geçişi sırasında infilak ettirildi. Can <kaybı> ve yaralanmanın meydana gelmediği patlamada, zırhlı araçlarda hasar, karayolunda da çukur oluştu. Ulaşımda da bir süre aksamaya neden olan patlamayla ilgili bölgede geniş çaplı operasyon başlatıldı.",1
260,"Bedensel <Engelliler> Basketbol Federasyonu, 26 Mayıs tarihinde Kanada'daki özel turnuvaya giden Milli Takım kafilesinin yer aldığı uçakta, oyuncusu Mustafa Muhittinoğlu'nu yumrukladığı gerekçesiyle hakkında soruşturma açtığı koç Harman Yazıcıoğlu'nun görevine son verdi. Yazıcıoğlu'nun yerine ise sezonu şampiyon tamamlayan BJK RMK Marine'nin koçu Tacettin Çıpa'nın getirildiği açıklandı. (Hürriyet) Bedensel engelli sporcuya antrenöründen yumruk!",1
794,"Gezi Parkı eylemleri sırasında ekmek almaya giderken polis tarafından gaz fişeğiyle vurulan ve aylardır yoğun bakımda <uyutulan> Berkin Elvan için dün akşam oynanan Galatasaray  -  Trabzonspor maçında pankart açıldı. Sarı - kırmızılı ekibin Trabzonspor'u 2 - 1'le geçtiği mücadelenin oynandığı TT Arena tribünlerinde, ""Uyan güzel çocuk, seninleyiz omuz omuza..."" yazılı pankart açıldı. ARENA'DA HER YER RÜŞVET HER YER YOLSUZLUK SLOGANLARI",0
707,"Eylül 1919 tarihli mektup, Yahudi insan hakları kuruluşu Simon Wiesenthal Merkezi tarafından elde edildi. Haham Marvin Hier, merkezin mektubu özel bir koleksiyoncuya geçen ay 150 bin dolar ödeyerek satın aldığını söyledi. Hier, mektubun Alman ordusuna ait bir daktiloyla yazıldığını bildirdi. Mektupta, ""Yahudi tehdidine"" karşı güçlü bir hükümet gerektiği ve ""Yahudilerin tamamen <ortadan kaldırılması>"" görüşü dile getiriliyor.",1
221,"Dünyanın en büyük cep telefonu üreticisi Nokia, küresel <ekonomik> krizin cep telefonu endüstrisini olumsuz etkilemesi nedeniyle maliyetleri düşürmek için Finlandiya'nın güneyindeki Jyvaskyla'daki araştırma ve geliştirme fabrikasını kapatacağını ve bu kararın fabrikada çalışan 320 kişiyi etkileyeceğini açıkladı. Nokia, daha önce Finlandiya'nın güneyindeki Salo'da bir fabrikada 2,500 kişinin işine son vereceğini bildirmişti.",0
431,"Galatasaray Kulübü'nden yapılan açıklamada, 86 yaşında dün <hayata gözlerini yuman> Doğan Koloğlu için ilk törenin yarın saat 10.00'da Türk Telekom Arena'daki Batı VIP Lounge'da gerçekleştirileceği belirtildi. Stattaki törenin basın mensuplarına kapalı olacağı kaydedildi. Doğan Koloğlu'nun cenazesi, Zincirlikuyu Camisi'nde cuma namazını müteakip kılınacak cenaze namazı sonrası Zincirlikuyu Mezarlığı'ndaki aile kabristanında toprağa verilecek.",1
532,"Mesajda şu detaylara yer verildi: Türk futbolunun önemli ismi, Beşiktaş Kulübü’nün Onursal Başkanı Süleyman Seba’nın hayatını <kaybettiği> haberini üzüntüyle öğrenmiş bulunmaktayız. Seba’ya Yüce Allah’tan rahmet, kederli ailesine, Türk futbol camiasına ve sevenlerine başsağlığı dileriz.",1
179,"Harp okulundan iki öğrencinin <cinsel ilişkiye girdikleri> sırada, erkek öğrencinin görüntüleri gizli kameraya kaydederek, canlı bir şekilde bir başka odadaki 6 akademili arkadaşına izlettiği iddia ediliyor. Asker adayı genç kadın öğrenci tüm dünyasının yıkıldığını belirtirken, olayla ilgili başlatılan soruşturma kapsamında erkek öğrenciler suçlu bulunurlarsa askeri kariyerleri sonlandırılacak. Etiketler:",1
554,"Tersanedeki bir geminin bordasını yıkayan Nurettin Bingöl (36) adlı işçi, koruma halatlarından birinin kopması sonucu ters dönen vinç sepetinden aşağıya düştü. Kazada hayatını <kaybeden> 2 çocuk babası Bingöl'ün cesedi, olay yerinde yapılan incelemenin ardından Adli Tıp Kurumuna kaldırıldı. Nurettin Bingöl'ün cenazesi memleketi Niğde'ye gönderilecek. Yaşanan son ölümle birlikte, Tuzla tersaneler bölgesindeki can kaybı sayısı 136'ya yükseldi.",1
464,"IHA Haber - iş Sendikası Şube Başkanı Erol Toprak geçirdiği kalp krizi ile <hayata gözlerini yumdu>. Haber - İş Sendikası Başkanı Erol Toprak, evinde geçirdiği kalp krizi geçirdi. Tüm müdahalelere rağmen kurtarılamayan Erol Toprak’ın cenazesi yarın öğle namazına müteakip, Tomarza İlçesi, Kapukaya Köyü’nden defnedilecek. Etiketler: haber , Kayseri Haberleri « önceki haber sonraki haber »",1
900,"Congres Beja adlı bölgesel bir partinin sözcüsü, hükümetin önümüzdeki günlerde bu sorunu çözüme kavuşturmak için hiçbir şey yapmaması durumunda, Sudan'ın doğusunda açlığın baş göstereceği uyarısında bulundu. Bölgenin <yoksul> olduğunu ve Sudan'da temel gıda maddesi olan Hint darısını satın alacak durumlarının kalmadığını belirten sözcü, ağustos ayında bu durum karşısında hükümeti uyardıklarını, şu anda Hint darısı fiyatlarının 18 dolardan 50 dolara fırladığını kaydetti.",1
580,"Başbakanlık Afet ve Acil Durum Yönetimi Başkanlığı (AFAD) Deprem Dairesi Başkanlığı'nın verilerine göre, saat 21.31'de Oniki adalar açıklarında Richter ölçeğine göre 4.2 büyüklüğünde bir deprem meydana geldi. Datça'ya 21 kilometre uzaklıkta yerin 22.84 kilometre altında meydana gelen deprem can ve mal <kaybına> yol açmadı. Boğaziçi Üniversitesi Kandilli Rasathanesi Deprem Araştırma Enstitüsü ise depremin büyüklüğünü Richter ölçeğine göre 4.0, derinliğini ise 17.3 kilometre olarak açıkladı.",0
849,"Haber spikeri Simge Fıstıkoğlu, babası Edip Mazhar Fıstıkoğlu'nu kaybetti. Fıstıkoğlu, sosyal medyada yaptığı paylaşımda babasının <vefat ettiğini> ""kalbimin sızısı"" notu ile duyurdu. Yayınlanan ilanda merhum Edip Mazhar Fıstıkoğlu'nun cenazesinin 4 Şubat 2016 perşembe günü Ataköy 5. Kısım Ömer Doruk Camii'nden ikindi namazına müteakip son yolculuğuna uğurlanacağı duyuruldu.",1
588,"Devlet televizyonu, hükümet komitesinin dün geç saatlerde, hava kirliliği seviyesi yüzünden tüm kamu kurumları, özel kuruluşlar, okullar ve tüm sanayi kuruluşlarının yarın tatil edilmesini kararlaştırdığını duyurdu. Televizyonun haberinde, hava kirliliği oranının hafta başında artmaya başladığı ve yarın en yüksek seviyeye çıkacağının tahmin edildiği kaydedildi. Eleştirmenler, her tatilin ülkede 130 milyon dolar mali <kayba> yol açtığını belirtiyor.",0
658,"Antalya Emniyet Müdürlüğü'nden yapılan yazılı açıklamaya göre, Antalya girişinde emniyet güçlerince gerçekleştirilen uygulama sırasında durdurulan bir araçta, bir miktar patlayıcı <madde> ele geçirildi., olayla ilgili olduğu belirlenen iki kişi gözaltına alındı. Zanlıların Antalya Emniyet Müdürlüğü Terörle Mücadele Şube Müdürlüğündeki sorgularının sürdüğü öğrenildi.",0
324,"The Doctors dizisinin setinde konuşan Beatie, karısı Nancy’yle, ""evliliklerinin kötü giden bir döneminde olduklarını"" söyleyerek, ""Şu anda ayrıyız"" ifadesini kullandı. Mastektomi ile <göğüslerini> aldıran, vajinası ve kadın üreme sisteminin sağlayan organları koruması nedeniyle çocuk doğurabilen Beatie, bu sayede çocuk doğurabilmişti. Ancak Beatie, geçen süre içerisinde geçirdiği yeni operasyonlar ve sürekli devam eden tedavisiyle, artık erkeklik sürecini tamamladı.",1
792,"Emniyet yetkilileri, El Kaide ve Ensar el Sünna'ya mensup 19 mahkumun, bu sabaha karşı 03.30'da Tasfirat cezaevinde gardiyanları ve diğer mahkumları, içine uyku ilacı yerleştirdikleri hurmalarla <uyuttuktan> sonra havalandırma bacalarından kaçmayı başardıklarını belirttiler. Firar eden mahkumlardan ikisinin idam hükümlüsü olduğu, diğerlerinin cinayet, adam kaçırma ve diğer suçlardan hüküm giydiklerini kaydedildi. Firari mahkumları bulmak için tüm kentin abluka altında olduğu bildirildi.",0
690,"Bugün bir gazetede yer alan ""Çocuk istemeyen Bakan eşinden boşandı"" haberine Maliye Bakanlığı'ndan jet hızıyla yanıt geldi. Bakanlıktan yapılan açıklamada, haberin ""hayal ürünü ve gerçek dışı olduğu"" iddia edildi. Açıklamada, haberin, ""özel hayat ile ilgili olduğu, etik değerlere uymadığı, maksatlı ve çarpıtılarak verildiği, ispata <muhtaç> bulunduğu"" da kaydedildi ve yasal hakların kullanılacağı belirtildi.",0
